"No.","Time","Source","Destination","Protocol","Length","Info"
"1","0.000000","ac:c1:ee:9e:9c:c3","Broadcast","ARP","42","Who has 192.168.43.153?  Tell 192.168.43.1"
"2","0.000033","HonHaiPr_8c:90:55","ac:c1:ee:9e:9c:c3","ARP","42","192.168.43.153 is at e0:06:e6:8c:90:55"
"3","3.587724","192.168.43.153","103.27.9.20","TCP","74","34573 > http [SYN] Seq=0 Win=14600 Len=0 MSS=1460 SACK_PERM=1 TSval=995258 TSecr=0 WS=128"
"4","3.838451","192.168.43.153","192.168.43.1","DNS","74","Standard query A www.iitd.ac.in"
"5","3.840562","192.168.43.1","192.168.43.153","DNS","90","Standard query response A 103.27.9.20"
"6","3.840998","192.168.43.153","103.27.9.20","TCP","74","34574 > http [SYN] Seq=0 Win=14600 Len=0 MSS=1460 SACK_PERM=1 TSval=995321 TSecr=0 WS=128"
"7","4.076460","103.27.9.20","192.168.43.153","TCP","74","http > 34574 [SYN, ACK] Seq=0 Ack=1 Win=14480 Len=0 MSS=1260 SACK_PERM=1 TSval=2043376632 TSecr=995321 WS=128"
"8","4.076497","192.168.43.153","103.27.9.20","TCP","66","34574 > http [ACK] Seq=1 Ack=1 Win=14720 Len=0 TSval=995380 TSecr=2043376632"
"9","4.076601","192.168.43.153","103.27.9.20","HTTP","491","GET / HTTP/1.1 "
"10","4.080701","103.27.9.20","192.168.43.153","TCP","74","http > 34573 [SYN, ACK] Seq=0 Ack=1 Win=14480 Len=0 MSS=1260 SACK_PERM=1 TSval=2043376632 TSecr=995258 WS=128"
"11","4.080738","192.168.43.153","103.27.9.20","TCP","66","34573 > http [ACK] Seq=1 Ack=1 Win=14720 Len=0 TSval=995381 TSecr=2043376632"
"12","4.144979","103.27.9.20","192.168.43.153","TCP","66","http > 34574 [ACK] Seq=1 Ack=426 Win=15616 Len=0 TSval=2043376650 TSecr=995380"
"13","4.806641","103.27.9.20","192.168.43.153","TCP","1314","[TCP segment of a reassembled PDU]"
"14","4.806663","192.168.43.153","103.27.9.20","TCP","66","34574 > http [ACK] Seq=426 Ack=1249 Win=17152 Len=0 TSval=995562 TSecr=2043376811"
"15","4.810555","103.27.9.20","192.168.43.153","TCP","1314","[TCP segment of a reassembled PDU]"
"16","4.810578","192.168.43.153","103.27.9.20","TCP","66","34574 > http [ACK] Seq=426 Ack=2497 Win=19712 Len=0 TSval=995563 TSecr=2043376811"
"17","4.819012","103.27.9.20","192.168.43.153","TCP","1314","[TCP segment of a reassembled PDU]"
"18","4.819036","192.168.43.153","103.27.9.20","TCP","66","34574 > http [ACK] Seq=426 Ack=3745 Win=22144 Len=0 TSval=995565 TSecr=2043376811"
"19","4.828074","103.27.9.20","192.168.43.153","TCP","1314","[TCP segment of a reassembled PDU]"
"20","4.828103","192.168.43.153","103.27.9.20","TCP","66","34574 > http [ACK] Seq=426 Ack=4993 Win=24704 Len=0 TSval=995568 TSecr=2043376811"
"21","4.834221","192.168.43.153","103.27.9.20","HTTP","591","GET /sites/default/files/ctools/css/2d4fe1c1412881a73110e50a115127de.css?Y HTTP/1.1 "
"22","4.834367","192.168.43.153","103.27.9.20","TCP","74","34575 > http [SYN] Seq=0 Win=14600 Len=0 MSS=1460 SACK_PERM=1 TSval=995569 TSecr=0 WS=128"
"23","4.834436","103.27.9.20","192.168.43.153","TCP","1314","[TCP segment of a reassembled PDU]"
"24","4.834456","192.168.43.153","103.27.9.20","TCP","66","34574 > http [ACK] Seq=426 Ack=6241 Win=27136 Len=0 TSval=995569 TSecr=2043376811"
"25","4.834461","192.168.43.153","103.27.9.20","TCP","74","34576 > http [SYN] Seq=0 Win=14600 Len=0 MSS=1460 SACK_PERM=1 TSval=995569 TSecr=0 WS=128"
"26","4.834541","192.168.43.153","103.27.9.20","TCP","74","34577 > http [SYN] Seq=0 Win=14600 Len=0 MSS=1460 SACK_PERM=1 TSval=995569 TSecr=0 WS=128"
"27","4.834608","192.168.43.153","103.27.9.20","TCP","74","34578 > http [SYN] Seq=0 Win=14600 Len=0 MSS=1460 SACK_PERM=1 TSval=995569 TSecr=0 WS=128"
"28","4.842129","103.27.9.20","192.168.43.153","TCP","1314","[TCP segment of a reassembled PDU]"
"29","4.842147","192.168.43.153","103.27.9.20","TCP","66","34574 > http [ACK] Seq=426 Ack=7489 Win=29696 Len=0 TSval=995571 TSecr=2043376811"
"30","4.848092","103.27.9.20","192.168.43.153","TCP","1314","[TCP segment of a reassembled PDU]"
"31","4.848115","192.168.43.153","103.27.9.20","TCP","66","34574 > http [ACK] Seq=426 Ack=8737 Win=32128 Len=0 TSval=995573 TSecr=2043376811"
"32","4.851373","103.27.9.20","192.168.43.153","HTTP","945","HTTP/1.1 200 OK  (text/html)"
"33","4.851383","192.168.43.153","103.27.9.20","TCP","66","34574 > http [ACK] Seq=426 Ack=9616 Win=34688 Len=0 TSval=995574 TSecr=2043376811"
"34","4.851461","192.168.43.153","103.27.9.20","HTTP","545","GET /modules/node/node.css?Y HTTP/1.1 "
"35","4.901565","103.27.9.20","192.168.43.153","TCP","74","http > 34576 [SYN, ACK] Seq=0 Ack=1 Win=14480 Len=0 MSS=1260 SACK_PERM=1 TSval=2043376839 TSecr=995569 WS=128"
"36","4.901599","192.168.43.153","103.27.9.20","TCP","66","34576 > http [ACK] Seq=1 Ack=1 Win=14720 Len=0 TSval=995586 TSecr=2043376839"
"37","4.901665","192.168.43.153","103.27.9.20","HTTP","551","GET /modules/system/defaults.css?Y HTTP/1.1 "
"38","4.906993","103.27.9.20","192.168.43.153","TCP","74","http > 34578 [SYN, ACK] Seq=0 Ack=1 Win=14480 Len=0 MSS=1260 SACK_PERM=1 TSval=2043376840 TSecr=995569 WS=128"
"39","4.907024","192.168.43.153","103.27.9.20","TCP","66","34578 > http [ACK] Seq=1 Ack=1 Win=14720 Len=0 TSval=995587 TSecr=2043376840"
"40","4.907114","192.168.43.153","103.27.9.20","HTTP","555","GET /modules/system/system-menus.css?Y HTTP/1.1 "
"41","4.907233","103.27.9.20","192.168.43.153","TCP","74","http > 34575 [SYN, ACK] Seq=0 Ack=1 Win=14480 Len=0 MSS=1260 SACK_PERM=1 TSval=2043376839 TSecr=995569 WS=128"
"42","4.907262","192.168.43.153","103.27.9.20","TCP","66","34575 > http [ACK] Seq=1 Ack=1 Win=14720 Len=0 TSval=995588 TSecr=2043376839"
"43","4.907316","192.168.43.153","103.27.9.20","HTTP","550","GET /modules/system/system.css?Y HTTP/1.1 "
"44","4.912363","103.27.9.20","192.168.43.153","TCP","74","http > 34577 [SYN, ACK] Seq=0 Ack=1 Win=14480 Len=0 MSS=1260 SACK_PERM=1 TSval=2043376840 TSecr=995569 WS=128"
"45","4.912409","192.168.43.153","103.27.9.20","TCP","66","34577 > http [ACK] Seq=1 Ack=1 Win=14720 Len=0 TSval=995589 TSecr=2043376840"
"46","4.912456","192.168.43.153","103.27.9.20","HTTP","545","GET /modules/user/user.css?Y HTTP/1.1 "
"47","4.943960","103.27.9.20","192.168.43.153","TCP","66","http > 34573 [ACK] Seq=1 Ack=526 Win=15616 Len=0 TSval=2043376848 TSecr=995569"
"48","4.947487","103.27.9.20","192.168.43.153","HTTP","317","HTTP/1.1 304 Not Modified "
"49","4.947511","192.168.43.153","103.27.9.20","TCP","66","34573 > http [ACK] Seq=526 Ack=252 Win=15744 Len=0 TSval=995598 TSecr=2043376848"
"50","4.947671","192.168.43.153","103.27.9.20","HTTP","595","GET /sites/default/modules/calendar/calendar_multiday/calendar_multiday.css?Y HTTP/1.1 "
"51","4.991599","103.27.9.20","192.168.43.153","TCP","66","http > 34574 [ACK] Seq=9616 Ack=905 Win=16640 Len=0 TSval=2043376861 TSecr=995574"
"52","4.995104","103.27.9.20","192.168.43.153","HTTP","316","HTTP/1.1 304 Not Modified "
"53","4.995387","192.168.43.153","103.27.9.20","HTTP","574","GET /sites/default/modules/cck/theme/content-module.css?Y HTTP/1.1 "
"54","5.062532","103.27.9.20","192.168.43.153","TCP","66","http > 34576 [ACK] Seq=1 Ack=486 Win=15616 Len=0 TSval=2043376879 TSecr=995586"
"55","5.062780","103.27.9.20","192.168.43.153","HTTP","317","HTTP/1.1 304 Not Modified "
"56","5.062801","192.168.43.153","103.27.9.20","TCP","66","34576 > http [ACK] Seq=486 Ack=252 Win=15744 Len=0 TSval=995626 TSecr=2043376879"
"57","5.062981","192.168.43.153","103.27.9.20","HTTP","567","GET /sites/default/modules/ctools/css/ctools.css?Y HTTP/1.1 "
"58","5.097518","103.27.9.20","192.168.43.153","TCP","66","http > 34578 [ACK] Seq=1 Ack=490 Win=15616 Len=0 TSval=2043376888 TSecr=995588"
"59","5.097768","103.27.9.20","192.168.43.153","HTTP","317","HTTP/1.1 304 Not Modified "
"60","5.097793","192.168.43.153","103.27.9.20","TCP","66","34578 > http [ACK] Seq=490 Ack=252 Win=15744 Len=0 TSval=995635 TSecr=2043376888"
"61","5.097983","192.168.43.153","103.27.9.20","HTTP","559","GET /sites/default/modules/date/date.css?Y HTTP/1.1 "
"62","5.132487","103.27.9.20","192.168.43.153","TCP","66","http > 34575 [ACK] Seq=1 Ack=485 Win=15616 Len=0 TSval=2043376895 TSecr=995588"
"63","5.132731","103.27.9.20","192.168.43.153","HTTP","318","HTTP/1.1 304 Not Modified "
"64","5.132749","192.168.43.153","103.27.9.20","TCP","66","34575 > http [ACK] Seq=485 Ack=253 Win=15744 Len=0 TSval=995644 TSecr=2043376895"
"65","5.132905","192.168.43.153","103.27.9.20","HTTP","583","GET /sites/default/modules/date/date_popup/themes/datepicker.css?Y HTTP/1.1 "
"66","5.167843","103.27.9.20","192.168.43.153","TCP","66","http > 34577 [ACK] Seq=1 Ack=480 Win=15616 Len=0 TSval=2043376904 TSecr=995589"
"67","5.168105","103.27.9.20","192.168.43.153","HTTP","317","HTTP/1.1 304 Not Modified "
"68","5.168130","192.168.43.153","103.27.9.20","TCP","66","34577 > http [ACK] Seq=480 Ack=252 Win=15744 Len=0 TSval=995653 TSecr=2043376904"
"69","5.168395","192.168.43.153","103.27.9.20","HTTP","588","GET /sites/default/modules/date/date_popup/themes/jquery.timeentry.css?Y HTTP/1.1 "
"70","5.193490","103.27.9.20","192.168.43.153","HTTP","317","HTTP/1.1 304 Not Modified "
"71","5.193744","192.168.43.153","103.27.9.20","HTTP","571","GET /sites/default/modules/dhtml_menu/dhtml_menu.css?Y HTTP/1.1 "
"72","5.208508","103.27.9.20","192.168.43.153","HTTP","316","HTTP/1.1 304 Not Modified "
"73","5.208681","192.168.43.153","103.27.9.20","HTTP","569","GET /sites/default/modules/filefield/filefield.css?Y HTTP/1.1 "
"74","5.233487","103.27.9.20","192.168.43.153","HTTP","316","HTTP/1.1 304 Not Modified "
"75","5.233697","192.168.43.153","103.27.9.20","HTTP","567","GET /sites/default/modules/panels/css/panels.css?Y HTTP/1.1 "
"76","5.258569","103.27.9.20","192.168.43.153","HTTP","316","HTTP/1.1 304 Not Modified "
"77","5.258726","192.168.43.153","103.27.9.20","HTTP","582","GET /sites/default/modules/cck/modules/fieldgroup/fieldgroup.css?Y HTTP/1.1 "
"78","5.283515","103.27.9.20","192.168.43.153","HTTP","316","HTTP/1.1 304 Not Modified "
"79","5.283686","192.168.43.153","103.27.9.20","HTTP","565","GET /sites/default/modules/views/css/views.css?Y HTTP/1.1 "
"80","5.303500","103.27.9.20","192.168.43.153","HTTP","315","HTTP/1.1 304 Not Modified "
"81","5.303696","192.168.43.153","103.27.9.20","HTTP","602","GET /sites/default/modules/panels/plugins/layouts/twocol_stacked/twocol_stacked.css?Y HTTP/1.1 "
"82","5.327556","103.27.9.20","192.168.43.153","HTTP","316","HTTP/1.1 304 Not Modified "
"83","5.327741","192.168.43.153","103.27.9.20","HTTP","582","GET /sites/all/modules/jcarousel/skins/tango/jcarousel-tango.css?Y HTTP/1.1 "
"84","5.342552","103.27.9.20","192.168.43.153","HTTP","316","HTTP/1.1 304 Not Modified "
"85","5.342832","192.168.43.153","103.27.9.20","HTTP","582","GET /sites/default/modules/views_nivo_slider/js/nivo-slider.css?Y HTTP/1.1 "
"86","5.365040","103.27.9.20","192.168.43.153","HTTP","316","HTTP/1.1 304 Not Modified "
"87","5.365183","192.168.43.153","103.27.9.20","HTTP","601","GET /sites/default/modules/views_nivo_slider/styles/default/custom-nivo-slider.css?Y HTTP/1.1 "
"88","5.373496","103.27.9.20","192.168.43.153","HTTP","315","HTTP/1.1 304 Not Modified "
"89","5.373596","192.168.43.153","103.27.9.20","HTTP","578","GET /sites/default/themes/fusion/fusion_core/css/style.css?Y HTTP/1.1 "
"90","5.408217","103.27.9.20","192.168.43.153","HTTP","316","HTTP/1.1 304 Not Modified "
"91","5.408316","192.168.43.153","103.27.9.20","HTTP","583","GET /sites/default/themes/fusion/fusion_core/css/typography.css?Y HTTP/1.1 "
"92","5.408743","103.27.9.20","192.168.43.153","HTTP","316","HTTP/1.1 304 Not Modified "
"93","5.408818","192.168.43.153","103.27.9.20","HTTP","581","GET /sites/default/themes/fusion/fusion_core/css/superfish.css?Y HTTP/1.1 "
"94","5.414211","103.27.9.20","192.168.43.153","HTTP","315","HTTP/1.1 304 Not Modified "
"95","5.414335","192.168.43.153","103.27.9.20","HTTP","588","GET /sites/default/themes/fusion/fusion_core/css/superfish-navbar.css?Y HTTP/1.1 "
"96","5.447746","103.27.9.20","192.168.43.153","HTTP","316","HTTP/1.1 304 Not Modified "
"97","5.447855","192.168.43.153","103.27.9.20","HTTP","590","GET /sites/default/themes/fusion/fusion_core/css/superfish-vertical.css?Y HTTP/1.1 "
"98","5.554287","103.27.9.20","192.168.43.153","HTTP","316","HTTP/1.1 304 Not Modified "
"99","5.554476","192.168.43.153","103.27.9.20","HTTP","589","GET /sites/default/themes/acquia_prosper/css/acquia-prosper-style.css?Y HTTP/1.1 "
"100","5.554571","103.27.9.20","192.168.43.153","HTTP","317","HTTP/1.1 304 Not Modified "
"101","5.554605","103.27.9.20","192.168.43.153","HTTP","317","HTTP/1.1 304 Not Modified "
"102","5.554744","192.168.43.153","103.27.9.20","HTTP","587","GET /sites/default/themes/acquia_prosper/design_packs/gray/gray.css?Y HTTP/1.1 "
"103","5.554918","192.168.43.153","103.27.9.20","HTTP","567","GET /sites/default/modules/jquery_update/replace/jquery.min.js?Y HTTP/1.1 "
"104","5.610141","103.27.9.20","192.168.43.153","HTTP","316","HTTP/1.1 304 Not Modified "
"105","5.610308","192.168.43.153","103.27.9.20","HTTP","524","GET /misc/drupal.js?Y HTTP/1.1 "
"106","5.629300","103.27.9.20","192.168.43.153","HTTP","316","HTTP/1.1 304 Not Modified "
"107","5.629520","192.168.43.153","103.27.9.20","HTTP","556","GET /sites/default/modules/dhtml_menu/dhtml_menu.js?Y HTTP/1.1 "
"108","5.643274","103.27.9.20","192.168.43.153","HTTP","316","HTTP/1.1 304 Not Modified "
"109","5.643556","192.168.43.153","103.27.9.20","HTTP","550","GET /sites/default/modules/panels/js/panels.js?Y HTTP/1.1 "
"110","5.663276","103.27.9.20","192.168.43.153","HTTP","317","HTTP/1.1 304 Not Modified "
"111","5.663557","192.168.43.153","103.27.9.20","HTTP","563","GET /sites/all/modules/jcarousel/js/jquery.jcarousel.min.js?Y HTTP/1.1 "
"112","5.673217","103.27.9.20","192.168.43.153","HTTP","317","HTTP/1.1 304 Not Modified "
"113","5.673470","192.168.43.153","103.27.9.20","HTTP","551","GET /sites/all/modules/jcarousel/js/jcarousel.js?Y HTTP/1.1 "
"114","5.689241","103.27.9.20","192.168.43.153","HTTP","317","HTTP/1.1 304 Not Modified "
"115","5.689475","192.168.43.153","103.27.9.20","HTTP","547","GET /sites/default/modules/views/js/base.js?Y HTTP/1.1 "
"116","5.704386","103.27.9.20","192.168.43.153","HTTP","317","HTTP/1.1 304 Not Modified "
"117","5.704544","192.168.43.153","103.27.9.20","HTTP","553","GET /sites/default/modules/views/js/ajax_view.js?Y HTTP/1.1 "
"118","5.713165","103.27.9.20","192.168.43.153","HTTP","317","HTTP/1.1 304 Not Modified "
"119","5.713367","192.168.43.153","103.27.9.20","HTTP","579","GET /sites/default/modules/views_nivo_slider/js/jquery.nivo.slider.pack.js?Y HTTP/1.1 "
"120","5.716519","103.27.9.20","192.168.43.153","HTTP","316","HTTP/1.1 304 Not Modified "
"121","5.716681","192.168.43.153","103.27.9.20","HTTP","572","GET /sites/default/modules/views_nivo_slider/js/views_nivo_slider.js?Y HTTP/1.1 "
"122","5.733232","103.27.9.20","192.168.43.153","HTTP","316","HTTP/1.1 304 Not Modified "
"123","5.733419","192.168.43.153","103.27.9.20","HTTP","555","GET /sites/default/modules/ticketyboo/ticketyboo.js?Y HTTP/1.1 "
"124","5.743245","103.27.9.20","192.168.43.153","HTTP","315","HTTP/1.1 304 Not Modified "
"125","5.743530","192.168.43.153","103.27.9.20","HTTP","574","GET /sites/default/themes/fusion/fusion_core/js/jquery.bgiframe.min.js?Y HTTP/1.1 "
"126","5.764239","103.27.9.20","192.168.43.153","HTTP","316","HTTP/1.1 304 Not Modified "
"127","5.764529","192.168.43.153","103.27.9.20","HTTP","566","GET /sites/default/themes/fusion/fusion_core/js/hoverIntent.js?Y HTTP/1.1 "
"128","5.779228","103.27.9.20","192.168.43.153","HTTP","317","HTTP/1.1 304 Not Modified "
"129","5.779480","192.168.43.153","103.27.9.20","HTTP","566","GET /sites/default/themes/fusion/fusion_core/js/supposition.js?Y HTTP/1.1 "
"130","5.789263","103.27.9.20","192.168.43.153","HTTP","317","HTTP/1.1 304 Not Modified "
"131","5.789523","192.168.43.153","103.27.9.20","HTTP","564","GET /sites/default/themes/fusion/fusion_core/js/supersubs.js?Y HTTP/1.1 "
"132","5.792572","103.27.9.20","192.168.43.153","HTTP","316","HTTP/1.1 304 Not Modified "
"133","5.792811","192.168.43.153","103.27.9.20","HTTP","564","GET /sites/default/themes/fusion/fusion_core/js/superfish.js?Y HTTP/1.1 "
"134","5.809734","103.27.9.20","192.168.43.153","HTTP","316","HTTP/1.1 304 Not Modified "
"135","5.810022","192.168.43.153","103.27.9.20","HTTP","562","GET /sites/default/themes/fusion/fusion_core/js/script.js?Y HTTP/1.1 "
"136","5.817960","103.27.9.20","192.168.43.153","HTTP","316","HTTP/1.1 304 Not Modified "
"137","5.818179","192.168.43.153","103.27.9.20","HTTP","565","GET /sites/default/themes/acquia_prosper/js/jquery.corner.js?Y HTTP/1.1 "
"138","5.839265","103.27.9.20","192.168.43.153","HTTP","316","HTTP/1.1 304 Not Modified "
"139","5.839419","192.168.43.153","103.27.9.20","HTTP","572","GET /sites/default/themes/acquia_prosper/js/acquia-prosper-script.js?Y HTTP/1.1 "
"140","5.854086","103.27.9.20","192.168.43.153","HTTP","316","HTTP/1.1 304 Not Modified "
"141","5.878195","103.27.9.20","192.168.43.153","HTTP","316","HTTP/1.1 304 Not Modified "
"142","5.878438","103.27.9.20","192.168.43.153","HTTP","316","HTTP/1.1 304 Not Modified "
"143","5.891063","192.168.43.153","103.27.9.20","TCP","66","34577 > http [ACK] Seq=3498 Ack=1753 Win=22144 Len=0 TSval=995834 TSecr=2043377075"
"144","5.909174","103.27.9.20","192.168.43.153","HTTP","317","HTTP/1.1 304 Not Modified "
"145","5.915051","192.168.43.153","103.27.9.20","TCP","66","34573 > http [ACK] Seq=4099 Ack=2004 Win=23296 Len=0 TSval=995840 TSecr=2043377078"
"146","5.915071","192.168.43.153","103.27.9.20","TCP","66","34574 > http [ACK] Seq=4444 Ack=11616 Win=42368 Len=0 TSval=995840 TSecr=2043377080"
"147","5.918200","103.27.9.20","192.168.43.153","HTTP","317","HTTP/1.1 304 Not Modified "
"148","5.939135","103.27.9.20","192.168.43.153","HTTP","316","HTTP/1.1 304 Not Modified "
"149","5.947051","192.168.43.153","103.27.9.20","TCP","66","34576 > http [ACK] Seq=4028 Ack=2004 Win=23296 Len=0 TSval=995848 TSecr=2043377090"
"150","5.955048","192.168.43.153","103.27.9.20","TCP","66","34578 > http [ACK] Seq=4024 Ack=2003 Win=23296 Len=0 TSval=995850 TSecr=2043377093"
"151","5.979047","192.168.43.153","103.27.9.20","TCP","66","34575 > http [ACK] Seq=4006 Ack=2005 Win=23296 Len=0 TSval=995856 TSecr=2043377096"
"152","6.202925","192.168.43.153","192.168.43.1","DNS","82","Standard query A internal.iitd.ernet.in"
"153","6.206042","192.168.43.1","192.168.43.153","DNS","82","Standard query response, No such name"
"154","6.206536","192.168.43.153","192.168.43.1","DNS","82","Standard query A internal.iitd.ernet.in"
"155","6.208440","192.168.43.1","192.168.43.153","DNS","82","Standard query response, No such name"
"156","6.208953","192.168.43.153","192.168.43.1","DNS","82","Standard query A internal.iitd.ernet.in"
"157","6.211853","192.168.43.1","192.168.43.153","DNS","82","Standard query response, No such name"
"158","6.212113","192.168.43.153","192.168.43.1","DNS","82","Standard query A internal.iitd.ernet.in"
"159","6.213727","192.168.43.1","192.168.43.153","DNS","82","Standard query response, No such name"
"160","8.301728","192.168.43.153","162.213.33.44","TCP","74","37945 > http [SYN] Seq=0 Win=14600 Len=0 MSS=1460 SACK_PERM=1 TSval=996436 TSecr=0 WS=128"
"161","8.594398","162.213.33.44","192.168.43.153","TCP","74","http > 37945 [SYN, ACK] Seq=0 Ack=1 Win=28960 Len=0 MSS=1260 SACK_PERM=1 TSval=1293872495 TSecr=996436 WS=128"
"162","8.594442","192.168.43.153","162.213.33.44","TCP","66","37945 > http [ACK] Seq=1 Ack=1 Win=14720 Len=0 TSval=996509 TSecr=1293872495"
"163","8.594618","192.168.43.153","162.213.33.44","HTTP","195","GET /v0/search HTTP/1.1 "
"164","8.914880","162.213.33.44","192.168.43.153","TCP","66","http > 37945 [ACK] Seq=1 Ack=130 Win=30080 Len=0 TSval=1293872570 TSecr=996509"
"165","8.915212","162.213.33.44","192.168.43.153","HTTP","402","HTTP/1.1 200 OK  (application/json)"
"166","8.915239","192.168.43.153","162.213.33.44","TCP","66","37945 > http [ACK] Seq=130 Ack=337 Win=15744 Len=0 TSval=996590 TSecr=1293872572"
"167","8.915276","162.213.33.44","192.168.43.153","TCP","66","http > 37945 [FIN, ACK] Seq=337 Ack=130 Win=30080 Len=0 TSval=1293872572 TSecr=996509"
"168","8.915539","192.168.43.153","162.213.33.44","TCP","66","37945 > http [FIN, ACK] Seq=130 Ack=338 Win=15744 Len=0 TSval=996590 TSecr=1293872572"
"169","9.234353","162.213.33.44","192.168.43.153","TCP","66","http > 37945 [ACK] Seq=338 Ack=131 Win=30080 Len=0 TSval=1293872643 TSecr=996590"
"170","10.302776","192.168.43.153","162.213.33.44","TCP","74","37946 > http [SYN] Seq=0 Win=14600 Len=0 MSS=1460 SACK_PERM=1 TSval=996936 TSecr=0 WS=128"
"171","10.514971","162.213.33.44","192.168.43.153","TCP","74","http > 37946 [SYN, ACK] Seq=0 Ack=1 Win=28960 Len=0 MSS=1260 SACK_PERM=1 TSval=1293872994 TSecr=996936 WS=128"
"172","10.514997","192.168.43.153","162.213.33.44","TCP","66","37946 > http [ACK] Seq=1 Ack=1 Win=14720 Len=0 TSval=996989 TSecr=1293872994"
"173","10.515186","192.168.43.153","162.213.33.44","HTTP","196","GET /v0/sources HTTP/1.1 "
"174","10.835627","162.213.33.44","192.168.43.153","TCP","66","http > 37946 [ACK] Seq=1 Ack=131 Win=30080 Len=0 TSval=1293873054 TSecr=996990"
"175","10.835954","162.213.33.44","192.168.43.153","HTTP","402","HTTP/1.1 200 OK  (application/json)"
"176","10.835968","192.168.43.153","162.213.33.44","TCP","66","37946 > http [ACK] Seq=131 Ack=337 Win=15744 Len=0 TSval=997070 TSecr=1293873054"
"177","10.835989","162.213.33.44","192.168.43.153","TCP","66","http > 37946 [FIN, ACK] Seq=337 Ack=131 Win=30080 Len=0 TSval=1293873054 TSecr=996990"
"178","10.836151","192.168.43.153","162.213.33.44","TCP","66","37946 > http [FIN, ACK] Seq=131 Ack=338 Win=15744 Len=0 TSval=997070 TSecr=1293873054"
"179","11.155141","162.213.33.44","192.168.43.153","TCP","66","http > 37946 [ACK] Seq=338 Ack=132 Win=30080 Len=0 TSval=1293873126 TSecr=997070"
"180","21.075684","192.168.43.153","103.27.9.20","TCP","66","34578 > http [FIN, ACK] Seq=4024 Ack=2003 Win=23296 Len=0 TSval=999630 TSecr=2043377093"
"181","21.075726","192.168.43.153","103.27.9.20","TCP","66","34577 > http [FIN, ACK] Seq=3498 Ack=1753 Win=22144 Len=0 TSval=999630 TSecr=2043377075"
"182","21.075743","192.168.43.153","103.27.9.20","TCP","66","34576 > http [FIN, ACK] Seq=4028 Ack=2004 Win=23296 Len=0 TSval=999630 TSecr=2043377090"
"183","21.075759","192.168.43.153","103.27.9.20","TCP","66","34575 > http [FIN, ACK] Seq=4006 Ack=2005 Win=23296 Len=0 TSval=999630 TSecr=2043377096"
"184","21.075773","192.168.43.153","103.27.9.20","TCP","66","34574 > http [FIN, ACK] Seq=4444 Ack=11616 Win=42368 Len=0 TSval=999630 TSecr=2043377080"
"185","21.075788","192.168.43.153","103.27.9.20","TCP","66","34573 > http [FIN, ACK] Seq=4099 Ack=2004 Win=23296 Len=0 TSval=999630 TSecr=2043377078"
"186","21.084791","103.27.9.20","192.168.43.153","TCP","66","http > 34577 [FIN, ACK] Seq=1753 Ack=3498 Win=22016 Len=0 TSval=2043380829 TSecr=995834"
"187","21.084811","192.168.43.153","103.27.9.20","TCP","66","34577 > http [ACK] Seq=3499 Ack=1754 Win=22144 Len=0 TSval=999632 TSecr=2043380829"
"188","21.085220","103.27.9.20","192.168.43.153","TCP","66","http > 34573 [FIN, ACK] Seq=2004 Ack=4099 Win=23168 Len=0 TSval=2043380831 TSecr=995840"
"189","21.085232","192.168.43.153","103.27.9.20","TCP","66","34573 > http [ACK] Seq=4100 Ack=2005 Win=23296 Len=0 TSval=999632 TSecr=2043380831"
"190","21.085244","103.27.9.20","192.168.43.153","TCP","66","http > 34574 [FIN, ACK] Seq=11616 Ack=4444 Win=24192 Len=0 TSval=2043380834 TSecr=995840"
"191","21.085249","192.168.43.153","103.27.9.20","TCP","66","34574 > http [ACK] Seq=4445 Ack=11617 Win=42368 Len=0 TSval=999632 TSecr=2043380834"
"192","21.085257","103.27.9.20","192.168.43.153","TCP","66","http > 34576 [FIN, ACK] Seq=2004 Ack=4028 Win=23168 Len=0 TSval=2043380844 TSecr=995848"
"193","21.085261","192.168.43.153","103.27.9.20","TCP","66","34576 > http [ACK] Seq=4029 Ack=2005 Win=23296 Len=0 TSval=999632 TSecr=2043380844"
"194","21.085267","103.27.9.20","192.168.43.153","TCP","66","http > 34578 [FIN, ACK] Seq=2003 Ack=4024 Win=23168 Len=0 TSval=2043380844 TSecr=995850"
"195","21.085270","192.168.43.153","103.27.9.20","TCP","66","34578 > http [ACK] Seq=4025 Ack=2004 Win=23296 Len=0 TSval=999632 TSecr=2043380844"
"196","21.085275","103.27.9.20","192.168.43.153","TCP","66","http > 34575 [FIN, ACK] Seq=2005 Ack=4006 Win=23168 Len=0 TSval=2043380850 TSecr=995856"
"197","21.085278","192.168.43.153","103.27.9.20","TCP","66","34575 > http [ACK] Seq=4007 Ack=2006 Win=23296 Len=0 TSval=999632 TSecr=2043380850"
"198","21.137115","103.27.9.20","192.168.43.153","TCP","66","http > 34578 [ACK] Seq=2004 Ack=4025 Win=23168 Len=0 TSval=2043380897 TSecr=999630"
"199","21.137343","103.27.9.20","192.168.43.153","TCP","66","http > 34576 [ACK] Seq=2005 Ack=4029 Win=23168 Len=0 TSval=2043380897 TSecr=999630"
"200","21.143958","103.27.9.20","192.168.43.153","TCP","66","http > 34577 [ACK] Seq=1754 Ack=3499 Win=22016 Len=0 TSval=2043380897 TSecr=999630"
"201","21.147352","103.27.9.20","192.168.43.153","TCP","66","http > 34574 [ACK] Seq=11617 Ack=4445 Win=24192 Len=0 TSval=2043380900 TSecr=999630"
"202","21.153032","103.27.9.20","192.168.43.153","TCP","66","http > 34575 [ACK] Seq=2006 Ack=4007 Win=23168 Len=0 TSval=2043380900 TSecr=999630"
"203","21.153364","103.27.9.20","192.168.43.153","TCP","66","http > 34573 [ACK] Seq=2005 Ack=4100 Win=23168 Len=0 TSval=2043380900 TSecr=999630"
"204","24.398962","ac:c1:ee:9e:9c:c3","Broadcast","ARP","42","Who has 192.168.43.153?  Tell 192.168.43.1"
"205","24.398989","HonHaiPr_8c:90:55","ac:c1:ee:9e:9c:c3","ARP","42","192.168.43.153 is at e0:06:e6:8c:90:55"
"206","30.034009","52.26.54.17","192.168.43.153","TLSv1","103","Encrypted Alert"
"207","30.034051","192.168.43.153","52.26.54.17","TCP","66","46428 > https [ACK] Seq=1 Ack=38 Win=193 Len=0 TSval=1001869 TSecr=193372413"
"208","35.164533","52.26.54.17","192.168.43.153","TCP","66","https > 46428 [FIN, ACK] Seq=38 Ack=1 Win=118 Len=0 TSval=193373663 TSecr=1001869"
"209","35.203087","192.168.43.153","52.26.54.17","TCP","66","46428 > https [ACK] Seq=1 Ack=39 Win=193 Len=0 TSval=1003162 TSecr=193373663"
"210","47.158154","ac:c1:ee:9e:9c:c3","Broadcast","ARP","42","Who has 192.168.43.153?  Tell 192.168.43.1"
"211","47.158169","HonHaiPr_8c:90:55","ac:c1:ee:9e:9c:c3","ARP","42","192.168.43.153 is at e0:06:e6:8c:90:55"
"212","68.048649","ac:c1:ee:9e:9c:c3","Broadcast","ARP","42","Who has 192.168.43.153?  Tell 192.168.43.1"
"213","68.048671","HonHaiPr_8c:90:55","ac:c1:ee:9e:9c:c3","ARP","42","192.168.43.153 is at e0:06:e6:8c:90:55"
"214","69.355693","192.168.43.153","162.213.33.44","TCP","74","37947 > http [SYN] Seq=0 Win=14600 Len=0 MSS=1460 SACK_PERM=1 TSval=1011700 TSecr=0 WS=128"
"215","69.740934","162.213.33.44","192.168.43.153","TCP","74","http > 37947 [SYN, ACK] Seq=0 Ack=1 Win=28960 Len=0 MSS=1260 SACK_PERM=1 TSval=1293887799 TSecr=1011700 WS=128"
"216","69.740983","192.168.43.153","162.213.33.44","TCP","66","37947 > http [ACK] Seq=1 Ack=1 Win=14720 Len=0 TSval=1011796 TSecr=1293887799"
"217","69.741330","192.168.43.153","162.213.33.44","HTTP","195","GET /v0/search HTTP/1.1 "
"218","69.933537","162.213.33.44","192.168.43.153","TCP","66","http > 37947 [ACK] Seq=1 Ack=130 Win=30080 Len=0 TSval=1293887846 TSecr=1011796"
"219","69.933746","162.213.33.44","192.168.43.153","HTTP","402","HTTP/1.1 200 OK  (application/json)"
"220","69.933772","192.168.43.153","162.213.33.44","TCP","66","37947 > http [ACK] Seq=130 Ack=337 Win=15744 Len=0 TSval=1011844 TSecr=1293887846"
"221","69.933829","162.213.33.44","192.168.43.153","TCP","66","http > 37947 [FIN, ACK] Seq=337 Ack=130 Win=30080 Len=0 TSval=1293887846 TSecr=1011796"
"222","69.934199","192.168.43.153","162.213.33.44","TCP","66","37947 > http [FIN, ACK] Seq=130 Ack=338 Win=15744 Len=0 TSval=1011844 TSecr=1293887846"
"223","70.374325","162.213.33.44","192.168.43.153","TCP","66","http > 37947 [ACK] Seq=338 Ack=131 Win=30080 Len=0 TSval=1293887898 TSecr=1011844"
"224","71.302424","192.168.43.153","162.213.33.44","TCP","74","37948 > http [SYN] Seq=0 Win=14600 Len=0 MSS=1460 SACK_PERM=1 TSval=1012186 TSecr=0 WS=128"
"225","71.798123","162.213.33.44","192.168.43.153","TCP","74","http > 37948 [SYN, ACK] Seq=0 Ack=1 Win=28960 Len=0 MSS=1260 SACK_PERM=1 TSval=1293888249 TSecr=1012186 WS=128"
"226","71.798149","192.168.43.153","162.213.33.44","TCP","66","37948 > http [ACK] Seq=1 Ack=1 Win=14720 Len=0 TSval=1012310 TSecr=1293888249"
"227","71.798333","192.168.43.153","162.213.33.44","HTTP","196","GET /v0/sources HTTP/1.1 "
"228","72.116778","162.213.33.44","192.168.43.153","TCP","66","http > 37948 [ACK] Seq=1 Ack=131 Win=30080 Len=0 TSval=1293888377 TSecr=1012310"
"229","72.117160","162.213.33.44","192.168.43.153","HTTP","402","HTTP/1.1 200 OK  (application/json)"
"230","72.117172","192.168.43.153","162.213.33.44","TCP","66","37948 > http [ACK] Seq=131 Ack=337 Win=15744 Len=0 TSval=1012390 TSecr=1293888377"
"231","72.117192","162.213.33.44","192.168.43.153","TCP","66","http > 37948 [FIN, ACK] Seq=337 Ack=131 Win=30080 Len=0 TSval=1293888377 TSecr=1012310"
"232","72.117320","192.168.43.153","162.213.33.44","TCP","66","37948 > http [FIN, ACK] Seq=131 Ack=338 Win=15744 Len=0 TSval=1012390 TSecr=1293888377"
"233","72.438068","162.213.33.44","192.168.43.153","TCP","66","http > 37948 [ACK] Seq=338 Ack=132 Win=30080 Len=0 TSval=1293888452 TSecr=1012390"
"234","76.240902","192.168.43.153","103.27.9.167","TCP","74","33425 > http [SYN] Seq=0 Win=14600 Len=0 MSS=1460 SACK_PERM=1 TSval=1013421 TSecr=0 WS=128"
"235","76.240961","192.168.43.153","192.168.43.1","DNS","74","Standard query A ird.iitd.ac.in"
"236","76.251971","192.168.43.1","192.168.43.153","DNS","90","Standard query response A 103.27.9.167"
"237","76.328424","103.27.9.167","192.168.43.153","TCP","74","http > 33425 [SYN, ACK] Seq=0 Ack=1 Win=28960 Len=0 MSS=1260 SACK_PERM=1 TSval=541014138 TSecr=1013421 WS=128"
"238","76.328475","192.168.43.153","103.27.9.167","TCP","66","33425 > http [ACK] Seq=1 Ack=1 Win=14720 Len=0 TSval=1013443 TSecr=541014138"
"239","76.328605","192.168.43.153","103.27.9.167","HTTP","473","GET /vacancies HTTP/1.1 "
"240","76.458300","103.27.9.167","192.168.43.153","TCP","66","http > 33425 [ACK] Seq=1 Ack=408 Win=30080 Len=0 TSval=541014171 TSecr=1013443"
"241","76.677395","103.27.9.167","192.168.43.153","TCP","1314","[TCP segment of a reassembled PDU]"
"242","76.677421","192.168.43.153","103.27.9.167","TCP","66","33425 > http [ACK] Seq=408 Ack=1249 Win=17152 Len=0 TSval=1013530 TSecr=541014225"
"243","76.677939","103.27.9.167","192.168.43.153","TCP","1314","[TCP segment of a reassembled PDU]"
"244","76.677950","192.168.43.153","103.27.9.167","TCP","66","33425 > http [ACK] Seq=408 Ack=2497 Win=19712 Len=0 TSval=1013530 TSecr=541014225"
"245","76.680826","103.27.9.167","192.168.43.153","TCP","1314","[TCP segment of a reassembled PDU]"
"246","76.680843","192.168.43.153","103.27.9.167","TCP","66","33425 > http [ACK] Seq=408 Ack=3745 Win=22144 Len=0 TSval=1013531 TSecr=541014225"
"247","76.684204","103.27.9.167","192.168.43.153","TCP","1314","[TCP segment of a reassembled PDU]"
"248","76.684217","192.168.43.153","103.27.9.167","TCP","66","33425 > http [ACK] Seq=408 Ack=4993 Win=24704 Len=0 TSval=1013532 TSecr=541014225"
"249","76.687584","103.27.9.167","192.168.43.153","HTTP","1296","HTTP/1.1 200 OK  (text/html)"
"250","76.687597","192.168.43.153","103.27.9.167","TCP","66","33425 > http [ACK] Seq=408 Ack=6223 Win=27136 Len=0 TSval=1013533 TSecr=541014225"
"251","76.871339","192.168.43.153","103.27.9.167","HTTP","516","GET /modules/node/node.css?5 HTTP/1.1 "
"252","76.871472","192.168.43.153","103.27.9.167","TCP","74","33426 > http [SYN] Seq=0 Win=14600 Len=0 MSS=1460 SACK_PERM=1 TSval=1013579 TSecr=0 WS=128"
"253","76.871502","192.168.43.153","103.27.9.167","TCP","74","33427 > http [SYN] Seq=0 Win=14600 Len=0 MSS=1460 SACK_PERM=1 TSval=1013579 TSecr=0 WS=128"
"254","76.871600","192.168.43.153","103.27.9.167","TCP","74","33428 > http [SYN] Seq=0 Win=14600 Len=0 MSS=1460 SACK_PERM=1 TSval=1013579 TSecr=0 WS=128"
"255","76.871654","192.168.43.153","103.27.9.167","TCP","74","33429 > http [SYN] Seq=0 Win=14600 Len=0 MSS=1460 SACK_PERM=1 TSval=1013579 TSecr=0 WS=128"
"256","76.871675","192.168.43.153","103.27.9.167","TCP","74","33430 > http [SYN] Seq=0 Win=14600 Len=0 MSS=1460 SACK_PERM=1 TSval=1013579 TSecr=0 WS=128"
"257","77.000319","103.27.9.167","192.168.43.153","TCP","74","http > 33426 [SYN, ACK] Seq=0 Ack=1 Win=28960 Len=0 MSS=1260 SACK_PERM=1 TSval=541014301 TSecr=1013579 WS=128"
"258","77.000366","192.168.43.153","103.27.9.167","TCP","66","33426 > http [ACK] Seq=1 Ack=1 Win=14720 Len=0 TSval=1013611 TSecr=541014301"
"259","77.000616","192.168.43.153","103.27.9.167","HTTP","522","GET /modules/system/defaults.css?5 HTTP/1.1 "
"260","77.003618","103.27.9.167","192.168.43.153","TCP","74","http > 33427 [SYN, ACK] Seq=0 Ack=1 Win=28960 Len=0 MSS=1260 SACK_PERM=1 TSval=541014307 TSecr=1013579 WS=128"
"261","77.003661","192.168.43.153","103.27.9.167","TCP","66","33427 > http [ACK] Seq=1 Ack=1 Win=14720 Len=0 TSval=1013612 TSecr=541014307"
"262","77.003774","192.168.43.153","103.27.9.167","HTTP","520","GET /modules/system/system.css?5 HTTP/1.1 "
"263","77.051244","103.27.9.167","192.168.43.153","TCP","74","http > 33430 [SYN, ACK] Seq=0 Ack=1 Win=28960 Len=0 MSS=1260 SACK_PERM=1 TSval=541014319 TSecr=1013579 WS=128"
"264","77.051269","192.168.43.153","103.27.9.167","TCP","66","33430 > http [ACK] Seq=1 Ack=1 Win=14720 Len=0 TSval=1013624 TSecr=541014319"
"265","77.051358","192.168.43.153","103.27.9.167","HTTP","545","GET /sites/default/modules/cck/theme/content-module.css?5 HTTP/1.1 "
"266","77.051868","103.27.9.167","192.168.43.153","TCP","74","http > 33428 [SYN, ACK] Seq=0 Ack=1 Win=28960 Len=0 MSS=1260 SACK_PERM=1 TSval=541014319 TSecr=1013579 WS=128"
"267","77.051881","192.168.43.153","103.27.9.167","TCP","66","33428 > http [ACK] Seq=1 Ack=1 Win=14720 Len=0 TSval=1013624 TSecr=541014319"
"268","77.051941","192.168.43.153","103.27.9.167","HTTP","526","GET /modules/system/system-menus.css?5 HTTP/1.1 "
"269","77.056309","103.27.9.167","192.168.43.153","TCP","74","http > 33429 [SYN, ACK] Seq=0 Ack=1 Win=28960 Len=0 MSS=1260 SACK_PERM=1 TSval=541014319 TSecr=1013579 WS=128"
"270","77.056323","192.168.43.153","103.27.9.167","TCP","66","33429 > http [ACK] Seq=1 Ack=1 Win=14720 Len=0 TSval=1013625 TSecr=541014319"
"271","77.056393","192.168.43.153","103.27.9.167","HTTP","516","GET /modules/user/user.css?5 HTTP/1.1 "
"272","77.103214","103.27.9.167","192.168.43.153","TCP","66","http > 33425 [ACK] Seq=6223 Ack=858 Win=31104 Len=0 TSval=541014332 TSecr=1013579"
"273","77.107092","103.27.9.167","192.168.43.153","HTTP","797","HTTP/1.1 200 OK  (text/css)"
"274","77.107106","192.168.43.153","103.27.9.167","TCP","66","33425 > http [ACK] Seq=858 Ack=6954 Win=29696 Len=0 TSval=1013638 TSecr=541014332"
"275","77.107255","192.168.43.153","103.27.9.167","HTTP","538","GET /sites/default/modules/ctools/css/ctools.css?5 HTTP/1.1 "
"276","77.171210","103.27.9.167","192.168.43.153","TCP","66","http > 33426 [ACK] Seq=1 Ack=457 Win=30080 Len=0 TSval=541014349 TSecr=1013611"
"277","77.182326","103.27.9.167","192.168.43.153","HTTP","851","HTTP/1.1 200 OK  (text/css)"
"278","77.182341","192.168.43.153","103.27.9.167","TCP","66","33426 > http [ACK] Seq=457 Ack=786 Win=16256 Len=0 TSval=1013656 TSecr=541014351"
"279","77.182486","192.168.43.153","103.27.9.167","HTTP","530","GET /sites/default/modules/date/date.css?5 HTTP/1.1 "
"280","77.222220","103.27.9.167","192.168.43.153","TCP","66","http > 33427 [ACK] Seq=1 Ack=455 Win=30080 Len=0 TSval=541014362 TSecr=1013612"
"281","77.236471","103.27.9.167","192.168.43.153","TCP","1314","[TCP segment of a reassembled PDU]"
"282","77.236509","192.168.43.153","103.27.9.167","TCP","66","33427 > http [ACK] Seq=455 Ack=1249 Win=17152 Len=0 TSval=1013670 TSecr=541014364"
"283","77.236790","103.27.9.167","192.168.43.153","TCP","1314","[TCP segment of a reassembled PDU]"
"284","77.236824","192.168.43.153","103.27.9.167","TCP","66","33427 > http [ACK] Seq=455 Ack=2497 Win=19712 Len=0 TSval=1013670 TSecr=541014364"
"285","77.239818","103.27.9.167","192.168.43.153","HTTP","778","HTTP/1.1 200 OK  (text/css)"
"286","77.239857","192.168.43.153","103.27.9.167","TCP","66","33427 > http [ACK] Seq=455 Ack=3209 Win=22144 Len=0 TSval=1013671 TSecr=541014364"
"287","77.240088","192.168.43.153","103.27.9.167","HTTP","558","GET /sites/default/modules/date/date_popup/themes/datepicker.1.7.css?5 HTTP/1.1 "
"288","77.260246","103.27.9.167","192.168.43.153","TCP","66","http > 33430 [ACK] Seq=1 Ack=480 Win=30080 Len=0 TSval=541014371 TSecr=1013624"
"289","77.271477","103.27.9.167","192.168.43.153","TCP","1314","[TCP segment of a reassembled PDU]"
"290","77.271515","192.168.43.153","103.27.9.167","TCP","66","33430 > http [ACK] Seq=480 Ack=1249 Win=17152 Len=0 TSval=1013679 TSecr=541014373"
"291","77.271714","103.27.9.167","192.168.43.153","HTTP","96","HTTP/1.1 200 OK  (text/css)"
"292","77.271745","192.168.43.153","103.27.9.167","TCP","66","33430 > http [ACK] Seq=480 Ack=1279 Win=17152 Len=0 TSval=1013679 TSecr=541014373"
"293","77.271938","192.168.43.153","103.27.9.167","HTTP","560","GET /sites/default/modules/date/date_popup/themes/jquery.timeentry.css?5 HTTP/1.1 "
"294","77.310237","103.27.9.167","192.168.43.153","TCP","66","http > 33428 [ACK] Seq=1 Ack=461 Win=30080 Len=0 TSval=541014383 TSecr=1013624"
"295","77.319768","103.27.9.167","192.168.43.153","HTTP","796","HTTP/1.1 200 OK  (text/css)"
"296","77.319797","192.168.43.153","103.27.9.167","TCP","66","33428 > http [ACK] Seq=461 Ack=731 Win=16128 Len=0 TSval=1013691 TSecr=541014386"
"297","77.320001","192.168.43.153","103.27.9.167","HTTP","542","GET /sites/default/modules/dhtml_menu/dhtml_menu.css?5 HTTP/1.1 "
"298","77.390230","103.27.9.167","192.168.43.153","TCP","66","http > 33429 [ACK] Seq=1 Ack=451 Win=30080 Len=0 TSval=541014402 TSecr=1013625"
"299","77.400359","103.27.9.167","192.168.43.153","HTTP","906","HTTP/1.1 200 OK  (text/css)"
"300","77.400391","192.168.43.153","103.27.9.167","TCP","66","33429 > http [ACK] Seq=451 Ack=841 Win=16384 Len=0 TSval=1013711 TSecr=541014404"
"301","77.400614","192.168.43.153","103.27.9.167","HTTP","540","GET /sites/default/modules/filefield/filefield.css?5 HTTP/1.1 "
"302","77.470333","103.27.9.167","192.168.43.153","HTTP","775","HTTP/1.1 200 OK  (text/css)"
"303","77.470467","192.168.43.153","103.27.9.167","HTTP","538","GET /sites/default/modules/panels/css/panels.css?5 HTTP/1.1 "
"304","77.522535","103.27.9.167","192.168.43.153","TCP","1314","[TCP segment of a reassembled PDU]"
"305","77.522879","103.27.9.167","192.168.43.153","HTTP","394","HTTP/1.1 200 OK  (text/css)"
"306","77.522892","192.168.43.153","103.27.9.167","TCP","66","33426 > http [ACK] Seq=921 Ack=2362 Win=21248 Len=0 TSval=1013741 TSecr=541014436"
"307","77.522963","192.168.43.153","103.27.9.167","HTTP","525","GET /misc/farbtastic/farbtastic.css?5 HTTP/1.1 "
"308","77.597571","103.27.9.167","192.168.43.153","TCP","1314","[TCP segment of a reassembled PDU]"
"309","77.597834","103.27.9.167","192.168.43.153","HTTP","130","HTTP/1.1 200 OK  (text/css)"
"310","77.597848","192.168.43.153","103.27.9.167","TCP","66","33427 > http [ACK] Seq=947 Ack=4521 Win=24704 Len=0 TSval=1013760 TSecr=541014455"
"311","77.597927","192.168.43.153","103.27.9.167","HTTP","538","GET /sites/default/modules/calendar/calendar.css?5 HTTP/1.1 "
"312","77.647366","103.27.9.167","192.168.43.153","HTTP","605","HTTP/1.1 200 OK  (text/css)"
"313","77.647519","192.168.43.153","103.27.9.167","HTTP","554","GET /sites/default/modules/cck/modules/fieldgroup/fieldgroup.css?5 HTTP/1.1 "
"314","77.701352","103.27.9.167","192.168.43.153","HTTP","1079","HTTP/1.1 200 OK  (text/css)"
"315","77.701507","192.168.43.153","103.27.9.167","HTTP","536","GET /sites/default/modules/views/css/views.css?5 HTTP/1.1 "
"316","77.751320","103.27.9.167","192.168.43.153","HTTP","916","HTTP/1.1 200 OK  (text/css)"
"317","77.751474","192.168.43.153","103.27.9.167","HTTP","548","GET /sites/default/themes/fusion/fusion_core/css/style.css?5 HTTP/1.1 "
"318","77.785554","103.27.9.167","192.168.43.153","HTTP","814","HTTP/1.1 200 OK  (text/css)"
"319","77.785701","192.168.43.153","103.27.9.167","HTTP","553","GET /sites/default/themes/fusion/fusion_core/css/typography.css?5 HTTP/1.1 "
"320","77.827188","103.27.9.167","192.168.43.153","HTTP","722","HTTP/1.1 200 OK  (text/css)"
"321","77.827320","192.168.43.153","103.27.9.167","HTTP","552","GET /sites/default/themes/fusion/fusion_core/css/superfish.css?5 HTTP/1.1 "
"322","77.872080","103.27.9.167","192.168.43.153","TCP","1314","[TCP segment of a reassembled PDU]"
"323","77.872472","103.27.9.167","192.168.43.153","TCP","1314","[TCP segment of a reassembled PDU]"
"324","77.872486","192.168.43.153","103.27.9.167","TCP","66","33427 > http [ACK] Seq=1419 Ack=7017 Win=29696 Len=0 TSval=1013829 TSecr=541014524"
"325","77.872506","103.27.9.167","192.168.43.153","HTTP","86","HTTP/1.1 200 OK  (text/css)"
"326","77.872590","192.168.43.153","103.27.9.167","HTTP","559","GET /sites/default/themes/fusion/fusion_core/css/superfish-navbar.css?5 HTTP/1.1 "
"327","77.906969","103.27.9.167","192.168.43.153","HTTP","623","HTTP/1.1 200 OK  (text/css)"
"328","77.907144","192.168.43.153","103.27.9.167","HTTP","561","GET /sites/default/themes/fusion/fusion_core/css/superfish-vertical.css?5 HTTP/1.1 "
"329","77.962945","103.27.9.167","192.168.43.153","HTTP","1108","HTTP/1.1 200 OK  (text/css)"
"330","77.963101","192.168.43.153","103.27.9.167","HTTP","559","GET /sites/default/themes/acquia_prosper/css/acquia-prosper-style.css?5 HTTP/1.1 "
"331","77.997127","103.27.9.167","192.168.43.153","TCP","1314","[TCP segment of a reassembled PDU]"
"332","77.997574","103.27.9.167","192.168.43.153","TCP","1314","[TCP segment of a reassembled PDU]"
"333","77.997595","192.168.43.153","103.27.9.167","TCP","66","33429 > http [ACK] Seq=1407 Ack=4187 Win=23040 Len=0 TSval=1013860 TSecr=541014553"
"334","78.000801","103.27.9.167","192.168.43.153","TCP","1314","[TCP segment of a reassembled PDU]"
"335","78.001129","103.27.9.167","192.168.43.153","TCP","1314","[TCP segment of a reassembled PDU]"
"336","78.001139","192.168.43.153","103.27.9.167","TCP","66","33429 > http [ACK] Seq=1407 Ack=6683 Win=28032 Len=0 TSval=1013861 TSecr=541014553"
"337","78.004214","103.27.9.167","192.168.43.153","TCP","1314","[TCP segment of a reassembled PDU]"
"338","78.004655","103.27.9.167","192.168.43.153","HTTP","939","HTTP/1.1 200 OK  (text/css)"
"339","78.004669","192.168.43.153","103.27.9.167","TCP","66","33429 > http [ACK] Seq=1407 Ack=8804 Win=33024 Len=0 TSval=1013862 TSecr=541014553"
"340","78.004795","192.168.43.153","103.27.9.167","HTTP","557","GET /sites/default/themes/acquia_prosper/design_packs/gray/gray.css?5 HTTP/1.1 "
"341","78.016910","103.27.9.167","192.168.43.153","TCP","1314","[TCP segment of a reassembled PDU]"
"342","78.017265","103.27.9.167","192.168.43.153","HTTP","662","HTTP/1.1 200 OK  (text/css)"
"343","78.017285","192.168.43.153","103.27.9.167","TCP","66","33425 > http [ACK] Seq=2289 Ack=10255 Win=39680 Len=0 TSval=1013865 TSecr=541014560"
"344","78.017433","192.168.43.153","103.27.9.167","HTTP","551","GET /sites/default/themes/fusion/fusion_core/css/grid16-960.css HTTP/1.1 "
"345","78.049057","103.27.9.167","192.168.43.153","TCP","1314","[TCP segment of a reassembled PDU]"
"346","78.049386","103.27.9.167","192.168.43.153","HTTP","347","HTTP/1.1 200 OK  (text/css)"
"347","78.049409","192.168.43.153","103.27.9.167","TCP","66","33426 > http [ACK] Seq=1866 Ack=4547 Win=28672 Len=0 TSval=1013873 TSecr=541014567"
"348","78.049515","192.168.43.153","103.27.9.167","HTTP","494","GET /misc/jquery.js?5 HTTP/1.1 "
"349","78.072053","103.27.9.167","192.168.43.153","HTTP","1250","HTTP/1.1 200 OK  (text/css)"
"350","78.072241","192.168.43.153","103.27.9.167","HTTP","494","GET /misc/drupal.js?5 HTTP/1.1 "
"351","78.107997","103.27.9.167","192.168.43.153","HTTP","1174","HTTP/1.1 200 OK  (text/css)"
"352","78.108244","192.168.43.153","103.27.9.167","HTTP","526","GET /sites/default/modules/dhtml_menu/dhtml_menu.js?5 HTTP/1.1 "
"353","78.141057","103.27.9.167","192.168.43.153","TCP","1314","[TCP segment of a reassembled PDU]"
"354","78.141436","103.27.9.167","192.168.43.153","TCP","1314","[TCP segment of a reassembled PDU]"
"355","78.141458","192.168.43.153","103.27.9.167","TCP","66","33428 > http [ACK] Seq=1900 Ack=5282 Win=25216 Len=0 TSval=1013896 TSecr=541014590"
"356","78.144510","103.27.9.167","192.168.43.153","TCP","1314","[TCP segment of a reassembled PDU]"
"357","78.148336","103.27.9.167","192.168.43.153","TCP","1314","[TCP segment of a reassembled PDU]"
"358","78.148355","192.168.43.153","103.27.9.167","TCP","66","33428 > http [ACK] Seq=1900 Ack=7778 Win=30208 Len=0 TSval=1013898 TSecr=541014590"
"359","78.148792","103.27.9.167","192.168.43.153","TCP","1314","[TCP segment of a reassembled PDU]"
"360","78.148813","103.27.9.167","192.168.43.153","HTTP","671","HTTP/1.1 200 OK  (text/css)"
"361","78.148826","192.168.43.153","103.27.9.167","TCP","66","33428 > http [ACK] Seq=1900 Ack=9631 Win=35200 Len=0 TSval=1013898 TSecr=541014590"
"362","78.148927","192.168.43.153","103.27.9.167","HTTP","521","GET /sites/default/modules/panels/js/panels.js?5 HTTP/1.1 "
"363","78.169021","103.27.9.167","192.168.43.153","TCP","1314","[TCP segment of a reassembled PDU]"
"364","78.169373","103.27.9.167","192.168.43.153","TCP","1314","[TCP segment of a reassembled PDU]"
"365","78.169398","192.168.43.153","103.27.9.167","TCP","66","33429 > http [ACK] Seq=1898 Ack=11300 Win=38016 Len=0 TSval=1013903 TSecr=541014596"
"366","78.172477","103.27.9.167","192.168.43.153","TCP","1314","[TCP segment of a reassembled PDU]"
"367","78.172966","103.27.9.167","192.168.43.153","TCP","1314","[TCP segment of a reassembled PDU]"
"368","78.172974","192.168.43.153","103.27.9.167","TCP","66","33429 > http [ACK] Seq=1898 Ack=13796 Win=42368 Len=0 TSval=1013904 TSecr=541014596"
"369","78.172988","103.27.9.167","192.168.43.153","HTTP","182","HTTP/1.1 200 OK  (text/css)"
"370","78.173046","192.168.43.153","103.27.9.167","HTTP","518","GET /sites/default/modules/views/js/base.js?5 HTTP/1.1 "
"371","78.187079","103.27.9.167","192.168.43.153","HTTP","942","HTTP/1.1 200 OK  (text/css)"
"372","78.187216","192.168.43.153","103.27.9.167","HTTP","523","GET /sites/default/modules/views/js/ajax_view.js?5 HTTP/1.1 "
"373","78.212037","103.27.9.167","192.168.43.153","TCP","1314","[TCP segment of a reassembled PDU]"
"374","78.212645","103.27.9.167","192.168.43.153","TCP","1314","[TCP segment of a reassembled PDU]"
"375","78.212659","192.168.43.153","103.27.9.167","TCP","66","33426 > http [ACK] Seq=2294 Ack=7043 Win=33664 Len=0 TSval=1013914 TSecr=541014608"
"376","78.212676","103.27.9.167","192.168.43.153","TCP","1314","[TCP segment of a reassembled PDU]"
"377","78.215568","103.27.9.167","192.168.43.153","TCP","1314","[TCP segment of a reassembled PDU]"
"378","78.215578","192.168.43.153","103.27.9.167","TCP","66","33426 > http [ACK] Seq=2294 Ack=9539 Win=38656 Len=0 TSval=1013915 TSecr=541014608"
"379","78.218959","103.27.9.167","192.168.43.153","TCP","1314","[TCP segment of a reassembled PDU]"
"380","78.222797","103.27.9.167","192.168.43.153","TCP","1314","[TCP segment of a reassembled PDU]"
"381","78.222806","192.168.43.153","103.27.9.167","TCP","66","33426 > http [ACK] Seq=2294 Ack=12035 Win=42368 Len=0 TSval=1013916 TSecr=541014608"
"382","78.223624","103.27.9.167","192.168.43.153","TCP","1314","[TCP segment of a reassembled PDU]"
"383","78.223637","103.27.9.167","192.168.43.153","TCP","1314","[TCP segment of a reassembled PDU]"
"384","78.223646","103.27.9.167","192.168.43.153","TCP","1314","[TCP segment of a reassembled PDU]"
"385","78.223653","192.168.43.153","103.27.9.167","TCP","66","33426 > http [ACK] Seq=2294 Ack=14531 Win=42368 Len=0 TSval=1013917 TSecr=541014608"
"386","78.226429","103.27.9.167","192.168.43.153","TCP","1314","[TCP segment of a reassembled PDU]"
"387","78.226442","192.168.43.153","103.27.9.167","TCP","66","33426 > http [ACK] Seq=2294 Ack=17027 Win=42368 Len=0 TSval=1013917 TSecr=541014608"
"388","78.238094","103.27.9.167","192.168.43.153","TCP","1314","[TCP segment of a reassembled PDU]"
"389","78.238449","103.27.9.167","192.168.43.153","TCP","1314","[TCP segment of a reassembled PDU]"
"390","78.238460","192.168.43.153","103.27.9.167","TCP","66","33427 > http [ACK] Seq=2340 Ack=10717 Win=37120 Len=0 TSval=1013920 TSecr=541014615"
"391","78.241500","103.27.9.167","192.168.43.153","TCP","1314","[TCP segment of a reassembled PDU]"
"392","78.241874","103.27.9.167","192.168.43.153","HTTP","251","HTTP/1.1 200 OK  (application/javascript)"
"393","78.241882","192.168.43.153","103.27.9.167","TCP","66","33427 > http [ACK] Seq=2340 Ack=12150 Win=42112 Len=0 TSval=1013921 TSecr=541014615"
"394","78.241949","192.168.43.153","103.27.9.167","HTTP","545","GET /sites/default/themes/fusion/fusion_core/js/jquery.bgiframe.min.js?5 HTTP/1.1 "
"395","78.264003","103.27.9.167","192.168.43.153","TCP","1314","[TCP segment of a reassembled PDU]"
"396","78.267824","103.27.9.167","192.168.43.153","TCP","1314","[TCP segment of a reassembled PDU]"
"397","78.267842","192.168.43.153","103.27.9.167","TCP","66","33430 > http [ACK] Seq=2417 Ack=5979 Win=29696 Len=0 TSval=1013928 TSecr=541014621"
"398","78.268356","103.27.9.167","192.168.43.153","TCP","1314","[TCP segment of a reassembled PDU]"
"399","78.268368","103.27.9.167","192.168.43.153","HTTP","161","HTTP/1.1 200 OK  (application/javascript)"
"400","78.268376","192.168.43.153","103.27.9.167","TCP","66","33430 > http [ACK] Seq=2417 Ack=7322 Win=32128 Len=0 TSval=1013928 TSecr=541014621"
"401","78.268430","192.168.43.153","103.27.9.167","HTTP","537","GET /sites/default/themes/fusion/fusion_core/js/hoverIntent.js?5 HTTP/1.1 "
"402","78.288085","103.27.9.167","192.168.43.153","TCP","1314","[TCP segment of a reassembled PDU]"
"403","78.288464","103.27.9.167","192.168.43.153","TCP","1314","[TCP segment of a reassembled PDU]"
"404","78.288478","192.168.43.153","103.27.9.167","TCP","66","33426 > http [ACK] Seq=2294 Ack=19523 Win=42368 Len=0 TSval=1013933 TSecr=541014627"
"405","78.291476","103.27.9.167","192.168.43.153","HTTP","1166","HTTP/1.1 200 OK  (application/javascript)"
"406","78.291547","192.168.43.153","103.27.9.167","HTTP","537","GET /sites/default/themes/fusion/fusion_core/js/supposition.js?5 HTTP/1.1 "
"407","78.292044","103.27.9.167","192.168.43.153","HTTP","759","HTTP/1.1 200 OK  (application/javascript)"
"408","78.292137","192.168.43.153","103.27.9.167","HTTP","535","GET /sites/default/themes/fusion/fusion_core/js/supersubs.js?5 HTTP/1.1 "
"409","78.327087","103.27.9.167","192.168.43.153","TCP","1314","[TCP segment of a reassembled PDU]"
"410","78.327333","103.27.9.167","192.168.43.153","HTTP","528","HTTP/1.1 200 OK  (application/javascript)"
"411","78.327344","192.168.43.153","103.27.9.167","TCP","66","33429 > http [ACK] Seq=2350 Ack=15622 Win=42368 Len=0 TSval=1013943 TSecr=541014636"
"412","78.327418","192.168.43.153","103.27.9.167","HTTP","535","GET /sites/default/themes/fusion/fusion_core/js/superfish.js?5 HTTP/1.1 "
"413","78.351106","103.27.9.167","192.168.43.153","TCP","1314","[TCP segment of a reassembled PDU]"
"414","78.351617","103.27.9.167","192.168.43.153","TCP","1314","[TCP segment of a reassembled PDU]"
"415","78.351628","192.168.43.153","103.27.9.167","TCP","66","33425 > http [ACK] Seq=3231 Ack=13627 Win=42368 Len=0 TSval=1013949 TSecr=541014644"
"416","78.351649","103.27.9.167","192.168.43.153","HTTP","269","HTTP/1.1 200 OK  (application/javascript)"
"417","78.351701","192.168.43.153","103.27.9.167","HTTP","532","GET /sites/default/themes/fusion/fusion_core/js/script.js?5 HTTP/1.1 "
"418","78.377092","103.27.9.167","192.168.43.153","TCP","1314","[TCP segment of a reassembled PDU]"
"419","78.377400","103.27.9.167","192.168.43.153","HTTP","104","HTTP/1.1 200 OK  (application/javascript)"
"420","78.377410","192.168.43.153","103.27.9.167","TCP","66","33427 > http [ACK] Seq=2819 Ack=13436 Win=42368 Len=0 TSval=1013955 TSecr=541014650"
"421","78.377481","192.168.43.153","103.27.9.167","HTTP","535","GET /sites/default/themes/acquia_prosper/js/jquery.corner.js?5 HTTP/1.1 "
"422","78.424036","103.27.9.167","192.168.43.153","TCP","1314","[TCP segment of a reassembled PDU]"
"423","78.424351","103.27.9.167","192.168.43.153","HTTP","517","HTTP/1.1 200 OK  (application/javascript)"
"424","78.424365","192.168.43.153","103.27.9.167","TCP","66","33430 > http [ACK] Seq=2888 Ack=9021 Win=37120 Len=0 TSval=1013967 TSecr=541014661"
"425","78.424437","192.168.43.153","103.27.9.167","HTTP","543","GET /sites/default/themes/acquia_prosper/js/acquia-prosper-script.js?5 HTTP/1.1 "
"426","78.452117","103.27.9.167","192.168.43.153","TCP","1314","[TCP segment of a reassembled PDU]"
"427","78.452353","103.27.9.167","192.168.43.153","HTTP","373","HTTP/1.1 200 OK  (application/javascript)"
"428","78.452366","192.168.43.153","103.27.9.167","TCP","66","33426 > http [ACK] Seq=2765 Ack=22178 Win=42368 Len=0 TSval=1013974 TSecr=541014669"
"429","78.452443","192.168.43.153","103.27.9.167","HTTP","551","GET /sites/default/files/acquia_prosper_logo.jpg HTTP/1.1 "
"430","78.477100","103.27.9.167","192.168.43.153","TCP","1314","[TCP segment of a reassembled PDU]"
"431","78.477520","103.27.9.167","192.168.43.153","HTTP","833","HTTP/1.1 200 OK  (application/javascript)"
"432","78.477532","192.168.43.153","103.27.9.167","TCP","66","33428 > http [ACK] Seq=2824 Ack=12339 Win=42368 Len=0 TSval=1013980 TSecr=541014675"
"433","78.477607","192.168.43.153","103.27.9.167","HTTP","543","GET /sites/default/themes/acquia_prosper/favicon.ico HTTP/1.1 "
"434","78.503047","103.27.9.167","192.168.43.153","TCP","1314","[TCP segment of a reassembled PDU]"
"435","78.503366","103.27.9.167","192.168.43.153","HTTP","800","HTTP/1.1 200 OK  (application/javascript)"
"436","78.503379","192.168.43.153","103.27.9.167","TCP","66","33429 > http [ACK] Seq=2819 Ack=17604 Win=42368 Len=0 TSval=1013987 TSecr=541014680"
"437","78.527026","103.27.9.167","192.168.43.153","TCP","1314","[TCP segment of a reassembled PDU]"
"438","78.527344","103.27.9.167","192.168.43.153","HTTP","904","HTTP/1.1 200 OK  (application/javascript)"
"439","78.527355","192.168.43.153","103.27.9.167","TCP","66","33425 > http [ACK] Seq=3697 Ack=15916 Win=42368 Len=0 TSval=1013993 TSecr=541014687"
"440","78.559067","103.27.9.167","192.168.43.153","TCP","1314","[TCP segment of a reassembled PDU]"
"441","78.559498","103.27.9.167","192.168.43.153","TCP","1314","[TCP segment of a reassembled PDU]"
"442","78.559511","192.168.43.153","103.27.9.167","TCP","66","33427 > http [ACK] Seq=3288 Ack=15932 Win=42368 Len=0 TSval=1014001 TSecr=541014695"
"443","78.559542","103.27.9.167","192.168.43.153","HTTP","585","HTTP/1.1 200 OK  (application/javascript)"
"444","78.592474","103.27.9.167","192.168.43.153","HTTP","718","HTTP/1.1 200 OK  (application/javascript)"
"445","78.599051","192.168.43.153","103.27.9.167","TCP","66","33427 > http [ACK] Seq=3288 Ack=16451 Win=42368 Len=0 TSval=1014011 TSecr=541014695"
"446","78.617042","103.27.9.167","192.168.43.153","TCP","1314","[TCP segment of a reassembled PDU]"
"447","78.617405","103.27.9.167","192.168.43.153","HTTP","1200","HTTP/1.1 200 OK  (JPEG JFIF image)"
"448","78.617417","192.168.43.153","103.27.9.167","TCP","66","33426 > http [ACK] Seq=3250 Ack=24560 Win=42368 Len=0 TSval=1014015 TSecr=541014710"
"449","78.631045","192.168.43.153","103.27.9.167","TCP","66","33430 > http [ACK] Seq=3365 Ack=9673 Win=39680 Len=0 TSval=1014019 TSecr=541014704"
"450","78.647069","103.27.9.167","192.168.43.153","TCP","1314","[TCP segment of a reassembled PDU]"
"451","78.647309","103.27.9.167","192.168.43.153","HTTP","82","HTTP/1.1 200 OK  (image/vnd.microsoft.icon)"
"452","78.647320","192.168.43.153","103.27.9.167","TCP","66","33428 > http [ACK] Seq=3301 Ack=13603 Win=42368 Len=0 TSval=1014023 TSecr=541014717"
"453","78.708611","192.168.43.153","103.27.9.167","HTTP","653","GET /sites/default/themes/acquia_prosper/design_packs/gray/images/primary-menu-bg.png HTTP/1.1 "
"454","78.708666","192.168.43.153","103.27.9.167","HTTP","560","GET /misc/menu-leaf.png HTTP/1.1 "
"455","78.811055","103.27.9.167","192.168.43.153","TCP","1314","[TCP segment of a reassembled PDU]"
"456","78.811279","103.27.9.167","192.168.43.153","HTTP","280","HTTP/1.1 200 OK  (PNG)"
"457","78.811301","192.168.43.153","103.27.9.167","TCP","66","33426 > http [ACK] Seq=3837 Ack=26022 Win=42368 Len=0 TSval=1014064 TSecr=541014758"
"458","78.836967","103.27.9.167","192.168.43.153","HTTP","614","HTTP/1.1 200 OK  (PNG)"
"459","78.848911","192.168.43.153","192.168.43.1","DNS","74","Standard query A www.iitd.ac.in"
"460","78.848997","192.168.43.153","192.168.43.1","DNS","81","Standard query A webmail.iitd.ernet.in"
"461","78.849144","192.168.43.153","192.168.43.1","DNS","82","Standard query A internal.iitd.ernet.in"
"462","78.852155","192.168.43.1","192.168.43.153","DNS","90","Standard query response A 103.27.9.20"
"463","78.852378","192.168.43.153","192.168.43.1","DNS","75","Standard query A iris.iitd.ac.in"
"464","78.852402","192.168.43.1","192.168.43.153","DNS","97","Standard query response A 103.27.9.10"
"465","78.852412","192.168.43.1","192.168.43.153","DNS","82","Standard query response, No such name"
"466","78.852504","192.168.43.153","192.168.43.1","DNS","82","Standard query A internal.iitd.ernet.in"
"467","78.856268","192.168.43.1","192.168.43.153","DNS","82","Standard query response, No such name"
"468","78.875047","192.168.43.153","103.27.9.167","TCP","66","33429 > http [ACK] Seq=3313 Ack=18152 Win=42368 Len=0 TSval=1014080 TSecr=541014763"
"469","78.941220","192.168.43.1","192.168.43.153","DNS","126","Standard query response, No such name"
"470","78.941631","192.168.43.153","192.168.43.1","DNS","75","Standard query A iris.iitd.ac.in"
"471","78.943461","192.168.43.1","192.168.43.153","DNS","75","Standard query response, No such name"
"472","78.943943","192.168.43.153","192.168.43.1","DNS","75","Standard query A iris.iitd.ac.in"
"473","78.945147","192.168.43.1","192.168.43.153","DNS","75","Standard query response, No such name"
"474","78.945342","192.168.43.153","192.168.43.1","DNS","75","Standard query A iris.iitd.ac.in"
"475","78.946462","192.168.43.1","192.168.43.153","DNS","75","Standard query response, No such name"
"476","81.329210","192.168.43.153","52.26.54.17","TCP","66","46428 > https [FIN, ACK] Seq=1 Ack=39 Win=193 Len=0 TSval=1014693 TSecr=193373663"
"477","81.717833","52.26.54.17","192.168.43.153","TCP","66","https > 46428 [ACK] Seq=39 Ack=2 Win=118 Len=0 TSval=193385360 TSecr=1014693"
"478","82.102479","192.168.43.153","103.27.9.167","HTTP","602","GET /sites/default/files/jobs/project/IITD-IRD-122-2017.pdf HTTP/1.1 "
"479","82.239849","103.27.9.167","192.168.43.153","TCP","1314","[TCP segment of a reassembled PDU]"
"480","82.240318","103.27.9.167","192.168.43.153","TCP","1314","[TCP segment of a reassembled PDU]"
"481","82.240333","192.168.43.153","103.27.9.167","TCP","66","33426 > http [ACK] Seq=4373 Ack=28518 Win=42368 Len=0 TSval=1014921 TSecr=541015616"
"482","82.243299","103.27.9.167","192.168.43.153","TCP","1314","[TCP segment of a reassembled PDU]"
"483","82.243789","103.27.9.167","192.168.43.153","TCP","1314","[TCP segment of a reassembled PDU]"
"484","82.243804","192.168.43.153","103.27.9.167","TCP","66","33426 > http [ACK] Seq=4373 Ack=31014 Win=42368 Len=0 TSval=1014922 TSecr=541015616"
"485","82.246764","103.27.9.167","192.168.43.153","TCP","1314","[TCP segment of a reassembled PDU]"
"486","82.247370","103.27.9.167","192.168.43.153","TCP","1314","[TCP segment of a reassembled PDU]"
"487","82.247384","192.168.43.153","103.27.9.167","TCP","66","33426 > http [ACK] Seq=4373 Ack=33510 Win=42368 Len=0 TSval=1014923 TSecr=541015616"
"488","82.247410","103.27.9.167","192.168.43.153","TCP","1314","[TCP segment of a reassembled PDU]"
"489","82.250312","103.27.9.167","192.168.43.153","TCP","1314","[TCP segment of a reassembled PDU]"
"490","82.250337","192.168.43.153","103.27.9.167","TCP","66","33426 > http [ACK] Seq=4373 Ack=36006 Win=42368 Len=0 TSval=1014923 TSecr=541015616"
"491","82.251265","103.27.9.167","192.168.43.153","TCP","1314","[TCP segment of a reassembled PDU]"
"492","82.251292","103.27.9.167","192.168.43.153","TCP","1314","[TCP segment of a reassembled PDU]"
"493","82.251362","192.168.43.153","103.27.9.167","TCP","66","33426 > http [ACK] Seq=4373 Ack=38502 Win=42368 Len=0 TSval=1014924 TSecr=541015616"
"494","82.322394","192.168.43.153","35.160.100.86","TLSv1","103","Encrypted Alert"
"495","82.322423","192.168.43.153","35.160.100.86","TCP","66","44266 > https [FIN, ACK] Seq=38 Ack=1 Win=180 Len=0 TSval=1014941 TSecr=64044773"
"496","82.339860","103.27.9.167","192.168.43.153","TCP","1314","[TCP segment of a reassembled PDU]"
"497","82.340340","103.27.9.167","192.168.43.153","TCP","1314","[TCP segment of a reassembled PDU]"
"498","82.340357","192.168.43.153","103.27.9.167","TCP","66","33426 > http [ACK] Seq=4373 Ack=40998 Win=42368 Len=0 TSval=1014946 TSecr=541015641"
"499","82.343325","103.27.9.167","192.168.43.153","TCP","1314","[TCP segment of a reassembled PDU]"
"500","82.343830","103.27.9.167","192.168.43.153","TCP","1314","[TCP segment of a reassembled PDU]"
"501","82.343842","192.168.43.153","103.27.9.167","TCP","66","33426 > http [ACK] Seq=4373 Ack=43494 Win=42368 Len=0 TSval=1014947 TSecr=541015641"
"502","82.358808","103.27.9.167","192.168.43.153","TCP","1314","[TCP segment of a reassembled PDU]"
"503","82.362390","103.27.9.167","192.168.43.153","HTTP","243","HTTP/1.1 200 OK  (application/pdf)"
"504","82.362411","192.168.43.153","103.27.9.167","TCP","66","33426 > http [ACK] Seq=4373 Ack=44919 Win=42368 Len=0 TSval=1014951 TSecr=541015646"
"505","82.677602","35.160.100.86","192.168.43.153","TCP","78","https > 44266 [ACK] Seq=1 Ack=1 Win=55 Len=0 TSval=64073651 TSecr=986188 SLE=38 SRE=39"
"506","82.689648","35.160.100.86","192.168.43.153","TCP","66","https > 44266 [ACK] Seq=1 Ack=39 Win=55 Len=0 TSval=64073661 TSecr=1014941"
"507","82.689940","35.160.100.86","192.168.43.153","TLSv1","103","Encrypted Alert"
"508","82.689980","192.168.43.153","35.160.100.86","TCP","54","44266 > https [RST] Seq=39 Win=0 Len=0"
"509","82.690012","35.160.100.86","192.168.43.153","TCP","66","https > 44266 [FIN, ACK] Seq=38 Ack=39 Win=55 Len=0 TSval=64073661 TSecr=1014941"
"510","82.690023","192.168.43.153","35.160.100.86","TCP","54","44266 > https [RST] Seq=39 Win=0 Len=0"
"511","83.322476","192.168.43.153","216.58.199.142","TCP","66","43004 > http [FIN, ACK] Seq=1 Ack=1 Win=173 Len=0 TSval=1015191 TSecr=952031141"
"512","83.416213","216.58.199.142","192.168.43.153","TCP","66","http > 43004 [FIN, ACK] Seq=1 Ack=2 Win=608 Len=0 TSval=952147034 TSecr=1015191"
"513","83.416257","192.168.43.153","216.58.199.142","TCP","66","43004 > http [ACK] Seq=2 Ack=2 Win=173 Len=0 TSval=1015215 TSecr=952147034"
"514","83.531218","103.27.9.167","192.168.43.153","TCP","66","http > 33425 [FIN, ACK] Seq=15916 Ack=3697 Win=37632 Len=0 TSval=541015939 TSecr=1013993"
"515","83.531359","192.168.43.153","103.27.9.167","TCP","66","33425 > http [FIN, ACK] Seq=3697 Ack=15917 Win=42368 Len=0 TSval=1015244 TSecr=541015939"
"516","83.586244","103.27.9.167","192.168.43.153","TCP","66","http > 33427 [FIN, ACK] Seq=16451 Ack=3288 Win=36480 Len=0 TSval=541015952 TSecr=1014011"
"517","83.586381","192.168.43.153","103.27.9.167","TCP","66","33427 > http [FIN, ACK] Seq=3288 Ack=16452 Win=42368 Len=0 TSval=1015257 TSecr=541015952"
"518","83.618174","103.27.9.167","192.168.43.153","TCP","66","http > 33425 [ACK] Seq=15917 Ack=3698 Win=37632 Len=0 TSval=541015961 TSecr=1015244"
"519","83.622042","103.27.9.167","192.168.43.153","TCP","66","http > 33430 [FIN, ACK] Seq=9673 Ack=3365 Win=36480 Len=0 TSval=541015961 TSecr=1014019"
"520","83.622174","192.168.43.153","103.27.9.167","TCP","66","33430 > http [FIN, ACK] Seq=3365 Ack=9674 Win=39680 Len=0 TSval=1015266 TSecr=541015961"
"521","83.656327","103.27.9.167","192.168.43.153","TCP","66","http > 33428 [FIN, ACK] Seq=13603 Ack=3301 Win=36480 Len=0 TSval=541015970 TSecr=1014023"
"522","83.656532","192.168.43.153","103.27.9.167","TCP","66","33428 > http [FIN, ACK] Seq=3301 Ack=13604 Win=42368 Len=0 TSval=1015275 TSecr=541015970"
"523","83.656607","103.27.9.167","192.168.43.153","TCP","66","http > 33427 [ACK] Seq=16452 Ack=3289 Win=36480 Len=0 TSval=541015971 TSecr=1015257"
"524","83.698643","103.27.9.167","192.168.43.153","TCP","66","http > 33430 [ACK] Seq=9674 Ack=3366 Win=36480 Len=0 TSval=541015981 TSecr=1015266"
"525","83.721339","103.27.9.167","192.168.43.153","TCP","66","http > 33428 [ACK] Seq=13604 Ack=3302 Win=36480 Len=0 TSval=541015986 TSecr=1015275"
"526","83.958357","103.27.9.167","192.168.43.153","TCP","66","http > 33429 [FIN, ACK] Seq=18152 Ack=3313 Win=36480 Len=0 TSval=541016018 TSecr=1014080"
"527","83.958487","192.168.43.153","103.27.9.167","TCP","66","33429 > http [FIN, ACK] Seq=3313 Ack=18153 Win=42368 Len=0 TSval=1015350 TSecr=541016018"
"528","84.086357","103.27.9.167","192.168.43.153","TCP","66","http > 33429 [ACK] Seq=18153 Ack=3314 Win=36480 Len=0 TSval=541016076 TSecr=1015350"
"529","85.040247","ac:c1:ee:9e:9c:c3","Broadcast","ARP","42","Who has 192.168.43.153?  Tell 192.168.43.1"
"530","85.040275","HonHaiPr_8c:90:55","ac:c1:ee:9e:9c:c3","ARP","42","192.168.43.153 is at e0:06:e6:8c:90:55"
"531","85.287319","192.168.43.153","192.168.43.1","DNS","94","Standard query A versioncheck-bg.addons.mozilla.org"
"532","85.316986","192.168.43.153","192.168.43.1","DNS","87","Standard query A services.addons.mozilla.org"
"533","85.362187","192.168.43.1","192.168.43.153","DNS","152","Standard query response CNAME versioncheck.prod.mozaws.net A 54.149.16.101"
"534","85.362886","192.168.43.153","192.168.43.1","DNS","94","Standard query A versioncheck-bg.addons.mozilla.org"
"535","85.364295","192.168.43.1","192.168.43.153","DNS","152","Standard query response CNAME versioncheck.prod.mozaws.net A 54.149.16.101"
"536","85.364556","192.168.43.153","54.149.16.101","TCP","74","45127 > https [SYN] Seq=0 Win=14600 Len=0 MSS=1460 SACK_PERM=1 TSval=1015702 TSecr=0 WS=128"
"537","85.365976","192.168.43.1","192.168.43.153","DNS","172","Standard query response CNAME olympia.prod.mozaws.net A 54.148.72.151 A 35.160.100.86 A 52.39.147.36"
"538","85.366152","192.168.43.153","192.168.43.1","DNS","87","Standard query A services.addons.mozilla.org"
"539","85.367629","192.168.43.1","192.168.43.153","DNS","172","Standard query response CNAME olympia.prod.mozaws.net A 52.39.147.36 A 35.160.100.86 A 54.148.72.151"
"540","85.367943","192.168.43.153","52.39.147.36","TCP","74","35804 > https [SYN] Seq=0 Win=14600 Len=0 MSS=1460 SACK_PERM=1 TSval=1015703 TSecr=0 WS=128"
"541","85.619713","192.168.43.153","192.168.43.1","DNS","94","Standard query A versioncheck-bg.addons.mozilla.org"
"542","85.622707","192.168.43.153","192.168.43.1","DNS","87","Standard query A services.addons.mozilla.org"
"543","85.623059","192.168.43.1","192.168.43.153","DNS","152","Standard query response CNAME versioncheck.prod.mozaws.net A 54.149.16.101"
"544","85.623228","192.168.43.153","192.168.43.1","DNS","94","Standard query A versioncheck-bg.addons.mozilla.org"
"545","85.625950","192.168.43.1","192.168.43.153","DNS","172","Standard query response CNAME olympia.prod.mozaws.net A 54.148.72.151 A 52.39.147.36 A 35.160.100.86"
"546","85.626091","192.168.43.153","192.168.43.1","DNS","87","Standard query A services.addons.mozilla.org"
"547","85.626239","192.168.43.1","192.168.43.153","DNS","152","Standard query response CNAME versioncheck.prod.mozaws.net A 54.149.16.101"
"548","85.626389","192.168.43.153","54.149.16.101","TCP","74","45129 > https [SYN] Seq=0 Win=14600 Len=0 MSS=1460 SACK_PERM=1 TSval=1015767 TSecr=0 WS=128"
"549","85.629179","192.168.43.1","192.168.43.153","DNS","172","Standard query response CNAME olympia.prod.mozaws.net A 35.160.100.86 A 54.148.72.151 A 52.39.147.36"
"550","85.629575","192.168.43.153","35.160.100.86","TCP","74","44294 > https [SYN] Seq=0 Win=14600 Len=0 MSS=1460 SACK_PERM=1 TSval=1015768 TSecr=0 WS=128"
"551","85.721604","54.149.16.101","192.168.43.153","TCP","74","https > 45127 [SYN, ACK] Seq=0 Ack=1 Win=26847 Len=0 MSS=1260 SACK_PERM=1 TSval=1489637350 TSecr=1015702 WS=256"
"552","85.721637","192.168.43.153","54.149.16.101","TCP","66","45127 > https [ACK] Seq=1 Ack=1 Win=14720 Len=0 TSval=1015791 TSecr=1489637350"
"553","85.721806","192.168.43.153","54.149.16.101","TLSv1","257","Client Hello"
"554","85.741099","52.39.147.36","192.168.43.153","TCP","74","https > 35804 [SYN, ACK] Seq=0 Ack=1 Win=26847 Len=0 MSS=1260 SACK_PERM=1 TSval=42251863 TSecr=1015703 WS=256"
"555","85.741130","192.168.43.153","52.39.147.36","TCP","66","35804 > https [ACK] Seq=1 Ack=1 Win=14720 Len=0 TSval=1015796 TSecr=42251863"
"556","85.741295","192.168.43.153","52.39.147.36","TLSv1","250","Client Hello"
"557","85.969068","54.149.16.101","192.168.43.153","TCP","74","https > 45129 [SYN, ACK] Seq=0 Ack=1 Win=26847 Len=0 MSS=1260 SACK_PERM=1 TSval=1489637399 TSecr=1015767 WS=256"
"558","85.969100","192.168.43.153","54.149.16.101","TCP","66","45129 > https [ACK] Seq=1 Ack=1 Win=14720 Len=0 TSval=1015853 TSecr=1489637399"
"559","85.969384","192.168.43.153","54.149.16.101","TLSv1","257","Client Hello"
"560","85.974573","35.160.100.86","192.168.43.153","TCP","74","https > 44294 [SYN, ACK] Seq=0 Ack=1 Win=26847 Len=0 MSS=1260 SACK_PERM=1 TSval=64074455 TSecr=1015768 WS=256"
"561","85.974608","192.168.43.153","35.160.100.86","TCP","66","44294 > https [ACK] Seq=1 Ack=1 Win=14720 Len=0 TSval=1015854 TSecr=64074455"
"562","85.974861","192.168.43.153","35.160.100.86","TLSv1","250","Client Hello"
"563","86.072497","54.149.16.101","192.168.43.153","TCP","66","https > 45127 [ACK] Seq=1 Ack=192 Win=28160 Len=0 TSval=1489637438 TSecr=1015791"
"564","86.076490","54.149.16.101","192.168.43.153","TLSv1","1314","Server Hello"
"565","86.076504","192.168.43.153","54.149.16.101","TCP","66","45127 > https [ACK] Seq=192 Ack=1249 Win=17152 Len=0 TSval=1015880 TSecr=1489637438"
"566","86.077144","54.149.16.101","192.168.43.153","TCP","1314","[TCP segment of a reassembled PDU]"
"567","86.077165","192.168.43.153","54.149.16.101","TCP","66","45127 > https [ACK] Seq=192 Ack=2497 Win=19712 Len=0 TSval=1015880 TSecr=1489637438"
"568","86.077178","54.149.16.101","192.168.43.153","TLSv1","643","Certificate, Server Key Exchange, Server Hello Done"
"569","86.077184","192.168.43.153","54.149.16.101","TCP","66","45127 > https [ACK] Seq=192 Ack=3074 Win=22144 Len=0 TSval=1015880 TSecr=1489637438"
"570","86.080487","192.168.43.153","54.149.16.101","TLSv1","200","Client Key Exchange, Change Cipher Spec, Encrypted Handshake Message"
"571","86.096534","52.39.147.36","192.168.43.153","TCP","66","https > 35804 [ACK] Seq=1 Ack=185 Win=11776 Len=0 TSval=42251997 TSecr=1015796"
"572","86.097125","52.39.147.36","192.168.43.153","TLSv1","590","Server Hello"
"573","86.097151","192.168.43.153","52.39.147.36","TCP","66","35804 > https [ACK] Seq=185 Ack=525 Win=15744 Len=0 TSval=1015885 TSecr=42251998"
"574","86.097174","52.39.147.36","192.168.43.153","TCP","590","[TCP segment of a reassembled PDU]"
"575","86.097181","192.168.43.153","52.39.147.36","TCP","66","35804 > https [ACK] Seq=185 Ack=1049 Win=16768 Len=0 TSval=1015885 TSecr=42251998"
"576","86.097188","52.39.147.36","192.168.43.153","TCP","590","[TCP segment of a reassembled PDU]"
"577","86.097192","192.168.43.153","52.39.147.36","TCP","66","35804 > https [ACK] Seq=185 Ack=1573 Win=17792 Len=0 TSval=1015885 TSecr=42251998"
"578","86.097198","52.39.147.36","192.168.43.153","TCP","590","[TCP segment of a reassembled PDU]"
"579","86.097202","192.168.43.153","52.39.147.36","TCP","66","35804 > https [ACK] Seq=185 Ack=2097 Win=18816 Len=0 TSval=1015885 TSecr=42251998"
"580","86.097208","52.39.147.36","192.168.43.153","TCP","590","[TCP segment of a reassembled PDU]"
"581","86.097210","192.168.43.153","52.39.147.36","TCP","66","35804 > https [ACK] Seq=185 Ack=2621 Win=19968 Len=0 TSval=1015885 TSecr=42251998"
"582","86.097466","52.39.147.36","192.168.43.153","TCP","590","[TCP segment of a reassembled PDU]"
"583","86.097486","192.168.43.153","52.39.147.36","TCP","66","35804 > https [ACK] Seq=185 Ack=3145 Win=20992 Len=0 TSval=1015885 TSecr=42251998"
"584","86.097498","52.39.147.36","192.168.43.153","TLSv1","586","Certificate, Server Key Exchange, Server Hello Done"
"585","86.097502","192.168.43.153","52.39.147.36","TCP","66","35804 > https [ACK] Seq=185 Ack=3665 Win=22016 Len=0 TSval=1015885 TSecr=42251998"
"586","86.101854","192.168.43.153","52.39.147.36","TLSv1","200","Client Key Exchange, Change Cipher Spec, Encrypted Handshake Message"
"587","86.282131","192.168.43.153","117.18.237.29","TCP","66","40475 > http [FIN, ACK] Seq=1 Ack=1 Win=202 Len=0 TSval=1015931 TSecr=2335145229"
"588","86.336732","54.149.16.101","192.168.43.153","TCP","66","https > 45129 [ACK] Seq=1 Ack=192 Win=11776 Len=0 TSval=1489637499 TSecr=1015853"
"589","86.337350","54.149.16.101","192.168.43.153","TLSv1","590","Server Hello"
"590","86.337374","192.168.43.153","54.149.16.101","TCP","66","45129 > https [ACK] Seq=192 Ack=525 Win=15744 Len=0 TSval=1015945 TSecr=1489637500"
"591","86.337411","54.149.16.101","192.168.43.153","TCP","590","[TCP segment of a reassembled PDU]"
"592","86.337425","192.168.43.153","54.149.16.101","TCP","66","45129 > https [ACK] Seq=192 Ack=1049 Win=16768 Len=0 TSval=1015945 TSecr=1489637500"
"593","86.337443","54.149.16.101","192.168.43.153","TCP","590","[TCP segment of a reassembled PDU]"
"594","86.337451","192.168.43.153","54.149.16.101","TCP","66","45129 > https [ACK] Seq=192 Ack=1573 Win=17792 Len=0 TSval=1015945 TSecr=1489637500"
"595","86.337469","54.149.16.101","192.168.43.153","TCP","590","[TCP segment of a reassembled PDU]"
"596","86.337478","192.168.43.153","54.149.16.101","TCP","66","45129 > https [ACK] Seq=192 Ack=2097 Win=18816 Len=0 TSval=1015945 TSecr=1489637500"
"597","86.337493","54.149.16.101","192.168.43.153","TCP","590","[TCP segment of a reassembled PDU]"
"598","86.337501","192.168.43.153","54.149.16.101","TCP","66","45129 > https [ACK] Seq=192 Ack=2621 Win=19968 Len=0 TSval=1015945 TSecr=1489637500"
"599","86.337877","54.149.16.101","192.168.43.153","TLSv1","519","Certificate, Server Key Exchange, Server Hello Done"
"600","86.337892","192.168.43.153","54.149.16.101","TCP","66","45129 > https [ACK] Seq=192 Ack=3074 Win=20992 Len=0 TSval=1015945 TSecr=1489637500"
"601","86.337916","35.160.100.86","192.168.43.153","TCP","66","https > 44294 [ACK] Seq=1 Ack=185 Win=11776 Len=0 TSval=64074570 TSecr=1015854"
"602","86.337938","35.160.100.86","192.168.43.153","TLSv1","590","Server Hello"
"603","86.337947","192.168.43.153","35.160.100.86","TCP","66","44294 > https [ACK] Seq=185 Ack=525 Win=15744 Len=0 TSval=1015945 TSecr=64074571"
"604","86.340882","35.160.100.86","192.168.43.153","TCP","590","[TCP segment of a reassembled PDU]"
"605","86.340895","192.168.43.153","35.160.100.86","TCP","66","44294 > https [ACK] Seq=185 Ack=1049 Win=16768 Len=0 TSval=1015946 TSecr=64074571"
"606","86.341433","192.168.43.153","54.149.16.101","TLSv1","200","Client Key Exchange, Change Cipher Spec, Encrypted Handshake Message"
"607","86.341715","35.160.100.86","192.168.43.153","TCP","590","[TCP segment of a reassembled PDU]"
"608","86.341731","192.168.43.153","35.160.100.86","TCP","66","44294 > https [ACK] Seq=185 Ack=1573 Win=17792 Len=0 TSval=1015946 TSecr=64074571"
"609","86.341756","35.160.100.86","192.168.43.153","TCP","590","[TCP segment of a reassembled PDU]"
"610","86.341764","192.168.43.153","35.160.100.86","TCP","66","44294 > https [ACK] Seq=185 Ack=2097 Win=18816 Len=0 TSval=1015946 TSecr=64074571"
"611","86.341776","35.160.100.86","192.168.43.153","TCP","590","[TCP segment of a reassembled PDU]"
"612","86.341782","192.168.43.153","35.160.100.86","TCP","66","44294 > https [ACK] Seq=185 Ack=2621 Win=19968 Len=0 TSval=1015946 TSecr=64074571"
"613","86.341792","35.160.100.86","192.168.43.153","TCP","590","[TCP segment of a reassembled PDU]"
"614","86.341798","192.168.43.153","35.160.100.86","TCP","66","44294 > https [ACK] Seq=185 Ack=3145 Win=20992 Len=0 TSval=1015946 TSecr=64074571"
"615","86.341808","35.160.100.86","192.168.43.153","TLSv1","586","Certificate, Server Key Exchange, Server Hello Done"
"616","86.341813","192.168.43.153","35.160.100.86","TCP","66","44294 > https [ACK] Seq=185 Ack=3665 Win=22016 Len=0 TSval=1015946 TSecr=64074571"
"617","86.349691","192.168.43.153","35.160.100.86","TLSv1","200","Client Key Exchange, Change Cipher Spec, Encrypted Handshake Message"
"618","86.390491","117.18.237.29","192.168.43.153","TCP","66","http > 40475 [FIN, ACK] Seq=1 Ack=2 Win=298 Len=0 TSval=2335174167 TSecr=1015931"
"619","86.390515","192.168.43.153","117.18.237.29","TCP","66","40475 > http [ACK] Seq=2 Ack=2 Win=202 Len=0 TSval=1015958 TSecr=2335174167"
"620","86.402485","54.149.16.101","192.168.43.153","TLSv1","125","Change Cipher Spec, Encrypted Handshake Message"
"621","86.403600","192.168.43.153","54.149.16.101","TLSv1","828","Application Data, Application Data"
"622","86.450079","52.39.147.36","192.168.43.153","TLSv1","125","Change Cipher Spec, Encrypted Handshake Message"
"623","86.451557","192.168.43.153","52.39.147.36","TLSv1","732","Application Data, Application Data"
"624","86.848091","54.149.16.101","192.168.43.153","TLSv1","125","Change Cipher Spec, Encrypted Handshake Message"
"625","86.848344","35.160.100.86","192.168.43.153","TLSv1","125","Change Cipher Spec, Encrypted Handshake Message"
"626","86.857366","54.149.16.101","192.168.43.153","TCP","1314","[TCP segment of a reassembled PDU]"
"627","86.857661","54.149.16.101","192.168.43.153","TLSv1","71","Application Data"
"628","86.857715","192.168.43.153","54.149.16.101","TCP","66","45127 > https [ACK] Seq=1088 Ack=4386 Win=24704 Len=0 TSval=1016075 TSecr=1489637633"
"629","86.887060","192.168.43.153","54.149.16.101","TCP","66","45129 > https [ACK] Seq=326 Ack=3133 Win=20992 Len=0 TSval=1016083 TSecr=1489637612"
"630","86.887095","192.168.43.153","35.160.100.86","TCP","66","44294 > https [ACK] Seq=319 Ack=3724 Win=22016 Len=0 TSval=1016083 TSecr=64074684"
"631","86.927225","52.39.147.36","192.168.43.153","TCP","590","[TCP segment of a reassembled PDU]"
"632","86.927878","52.39.147.36","192.168.43.153","TCP","590","[TCP segment of a reassembled PDU]"
"633","86.927916","192.168.43.153","52.39.147.36","TCP","66","35804 > https [ACK] Seq=985 Ack=4772 Win=24064 Len=0 TSval=1016093 TSecr=42252205"
"634","86.927957","52.39.147.36","192.168.43.153","TCP","590","[TCP segment of a reassembled PDU]"
"635","86.927976","52.39.147.36","192.168.43.153","TCP","590","[TCP segment of a reassembled PDU]"
"636","86.927987","192.168.43.153","52.39.147.36","TCP","66","35804 > https [ACK] Seq=985 Ack=5820 Win=26240 Len=0 TSval=1016093 TSecr=42252205"
"637","86.928009","52.39.147.36","192.168.43.153","TCP","590","[TCP segment of a reassembled PDU]"
"638","86.928025","52.39.147.36","192.168.43.153","TCP","590","[TCP segment of a reassembled PDU]"
"639","86.928033","192.168.43.153","52.39.147.36","TCP","66","35804 > https [ACK] Seq=985 Ack=6868 Win=28288 Len=0 TSval=1016093 TSecr=42252205"
"640","86.928049","52.39.147.36","192.168.43.153","TLSv1","239","Application Data"
"641","86.967059","192.168.43.153","52.39.147.36","TCP","66","35804 > https [ACK] Seq=985 Ack=7041 Win=29312 Len=0 TSval=1016103 TSecr=42252205"
"642","87.275001","192.168.43.153","54.148.180.133","TLSv1","103","Encrypted Alert"
"643","87.275205","192.168.43.153","54.148.180.133","TCP","66","47437 > https [FIN, ACK] Seq=38 Ack=1 Win=331 Len=0 TSval=1016180 TSecr=237068157"
"644","87.326135","192.168.43.153","54.149.16.101","TLSv1","780","Application Data, Application Data"
"645","87.326458","192.168.43.153","54.149.16.101","TLSv1","796","Application Data, Application Data"
"646","87.327140","192.168.43.153","192.168.43.1","DNS","94","Standard query A versioncheck-bg.addons.mozilla.org"
"647","87.330141","192.168.43.1","192.168.43.153","DNS","152","Standard query response CNAME versioncheck.prod.mozaws.net A 54.149.16.101"
"648","87.330471","192.168.43.153","192.168.43.1","DNS","94","Standard query A versioncheck-bg.addons.mozilla.org"
"649","87.333737","192.168.43.1","192.168.43.153","DNS","152","Standard query response CNAME versioncheck.prod.mozaws.net A 54.149.16.101"
"650","87.334192","192.168.43.153","54.149.16.101","TCP","74","45131 > https [SYN] Seq=0 Win=14600 Len=0 MSS=1460 SACK_PERM=1 TSval=1016194 TSecr=0 WS=128"
"651","87.334391","192.168.43.153","54.149.16.101","TCP","74","45132 > https [SYN] Seq=0 Win=14600 Len=0 MSS=1460 SACK_PERM=1 TSval=1016194 TSecr=0 WS=128"
"652","87.334459","192.168.43.153","54.149.16.101","TCP","74","45133 > https [SYN] Seq=0 Win=14600 Len=0 MSS=1460 SACK_PERM=1 TSval=1016194 TSecr=0 WS=128"
"653","87.336666","103.27.9.167","192.168.43.153","TCP","66","http > 33426 [FIN, ACK] Seq=44919 Ack=4373 Win=38912 Len=0 TSval=541016873 TSecr=1014951"
"654","87.336814","192.168.43.153","103.27.9.167","TCP","66","33426 > http [FIN, ACK] Seq=4373 Ack=44920 Win=42368 Len=0 TSval=1016195 TSecr=541016873"
"655","87.406492","103.27.9.167","192.168.43.153","TCP","66","http > 33426 [ACK] Seq=44920 Ack=4374 Win=38912 Len=0 TSval=541016907 TSecr=1016195"
"656","87.586876","192.168.43.153","192.168.43.1","DNS","94","Standard query A versioncheck-bg.addons.mozilla.org"
"657","87.590040","192.168.43.1","192.168.43.153","DNS","152","Standard query response CNAME versioncheck.prod.mozaws.net A 54.149.16.101"
"658","87.590572","192.168.43.153","192.168.43.1","DNS","94","Standard query A versioncheck-bg.addons.mozilla.org"
"659","87.593726","192.168.43.1","192.168.43.153","DNS","152","Standard query response CNAME versioncheck.prod.mozaws.net A 54.149.16.101"
"660","87.594238","192.168.43.153","54.149.16.101","TCP","74","45134 > https [SYN] Seq=0 Win=14600 Len=0 MSS=1460 SACK_PERM=1 TSval=1016259 TSecr=0 WS=128"
"661","87.594401","192.168.43.153","54.149.16.101","TCP","74","45135 > https [SYN] Seq=0 Win=14600 Len=0 MSS=1460 SACK_PERM=1 TSval=1016259 TSecr=0 WS=128"
"662","87.594533","192.168.43.153","54.149.16.101","TCP","74","45136 > https [SYN] Seq=0 Win=14600 Len=0 MSS=1460 SACK_PERM=1 TSval=1016259 TSecr=0 WS=128"
"663","87.657191","54.148.180.133","192.168.43.153","TCP","78","https > 47437 [ACK] Seq=1 Ack=1 Win=118 Len=0 TSval=237097078 TSecr=987428 SLE=38 SRE=39"
"664","87.657495","54.149.16.101","192.168.43.153","TCP","74","https > 45131 [SYN, ACK] Seq=0 Ack=1 Win=26847 Len=0 MSS=1260 SACK_PERM=1 TSval=1489637783 TSecr=1016194 WS=256"
"665","87.657550","192.168.43.153","54.149.16.101","TCP","66","45131 > https [ACK] Seq=1 Ack=1 Win=14720 Len=0 TSval=1016275 TSecr=1489637783"
"666","87.657614","54.148.180.133","192.168.43.153","TCP","66","https > 47437 [ACK] Seq=1 Ack=39 Win=118 Len=0 TSval=237097081 TSecr=1016179"
"667","87.657697","54.148.180.133","192.168.43.153","TLSv1","103","Encrypted Alert"
"668","87.657752","192.168.43.153","54.148.180.133","TCP","54","47437 > https [RST] Seq=39 Win=0 Len=0"
"669","87.657810","54.148.180.133","192.168.43.153","TCP","66","https > 47437 [FIN, ACK] Seq=38 Ack=39 Win=118 Len=0 TSval=237097081 TSecr=1016179"
"670","87.657836","192.168.43.153","54.148.180.133","TCP","54","47437 > https [RST] Seq=39 Win=0 Len=0"
"671","87.657894","54.149.16.101","192.168.43.153","TCP","74","https > 45132 [SYN, ACK] Seq=0 Ack=1 Win=26847 Len=0 MSS=1260 SACK_PERM=1 TSval=1489637783 TSecr=1016194 WS=256"
"672","87.657932","192.168.43.153","54.149.16.101","TCP","66","45132 > https [ACK] Seq=1 Ack=1 Win=14720 Len=0 TSval=1016275 TSecr=1489637783"
"673","87.657981","54.149.16.101","192.168.43.153","TCP","74","https > 45133 [SYN, ACK] Seq=0 Ack=1 Win=26847 Len=0 MSS=1260 SACK_PERM=1 TSval=1489637783 TSecr=1016194 WS=256"
"674","87.658011","192.168.43.153","54.149.16.101","TCP","66","45133 > https [ACK] Seq=1 Ack=1 Win=14720 Len=0 TSval=1016275 TSecr=1489637783"
"675","87.658109","192.168.43.153","54.149.16.101","TLSv1","289","Client Hello"
"676","87.658585","192.168.43.153","54.149.16.101","TLSv1","289","Client Hello"
"677","87.658811","192.168.43.153","54.149.16.101","TLSv1","289","Client Hello"
"678","87.707624","54.149.16.101","192.168.43.153","TLSv1","1287","Application Data"
"679","87.747081","192.168.43.153","54.149.16.101","TCP","66","45127 > https [ACK] Seq=1802 Ack=5607 Win=27136 Len=0 TSval=1016298 TSecr=1489637845"
"680","87.757208","54.149.16.101","192.168.43.153","TCP","590","[TCP segment of a reassembled PDU]"
"681","87.757261","192.168.43.153","54.149.16.101","TCP","66","45129 > https [ACK] Seq=1056 Ack=3657 Win=22016 Len=0 TSval=1016300 TSecr=1489637859"
"682","87.757679","54.149.16.101","192.168.43.153","TLSv1","363","Application Data"
"683","87.757705","192.168.43.153","54.149.16.101","TCP","66","45129 > https [ACK] Seq=1056 Ack=3954 Win=23040 Len=0 TSval=1016300 TSecr=1489637859"
"684","87.937107","54.149.16.101","192.168.43.153","TCP","74","https > 45135 [SYN, ACK] Seq=0 Ack=1 Win=26847 Len=0 MSS=1260 SACK_PERM=1 TSval=1489637903 TSecr=1016259 WS=256"
"685","87.937153","192.168.43.153","54.149.16.101","TCP","66","45135 > https [ACK] Seq=1 Ack=1 Win=14720 Len=0 TSval=1016345 TSecr=1489637903"
"686","87.937474","192.168.43.153","54.149.16.101","TLSv1","289","Client Hello"
"687","87.947077","54.149.16.101","192.168.43.153","TCP","74","https > 45134 [SYN, ACK] Seq=0 Ack=1 Win=26847 Len=0 MSS=1260 SACK_PERM=1 TSval=1489637847 TSecr=1016259 WS=256"
"688","87.947126","192.168.43.153","54.149.16.101","TCP","66","45134 > https [ACK] Seq=1 Ack=1 Win=14720 Len=0 TSval=1016347 TSecr=1489637847"
"689","87.947539","192.168.43.153","54.149.16.101","TLSv1","289","Client Hello"
"690","87.950491","54.149.16.101","192.168.43.153","TCP","74","https > 45136 [SYN, ACK] Seq=0 Ack=1 Win=26847 Len=0 MSS=1260 SACK_PERM=1 TSval=1489637907 TSecr=1016259 WS=256"
"691","87.950547","192.168.43.153","54.149.16.101","TCP","66","45136 > https [ACK] Seq=1 Ack=1 Win=14720 Len=0 TSval=1016348 TSecr=1489637907"
"692","87.950996","192.168.43.153","54.149.16.101","TLSv1","289","Client Hello"
"693","87.991265","54.149.16.101","192.168.43.153","TCP","66","https > 45131 [ACK] Seq=1 Ack=224 Win=11776 Len=0 TSval=1489637917 TSecr=1016275"
"694","87.991578","54.149.16.101","192.168.43.153","TLSv1","219","Server Hello, Change Cipher Spec, Encrypted Handshake Message"
"695","87.991609","192.168.43.153","54.149.16.101","TCP","66","45131 > https [ACK] Seq=224 Ack=154 Win=15744 Len=0 TSval=1016359 TSecr=1489637917"
"696","87.992207","192.168.43.153","54.149.16.101","TLSv1","125","Change Cipher Spec, Encrypted Handshake Message"
"697","87.992992","192.168.43.153","54.149.16.101","TLSv1","764","Application Data, Application Data"
"698","88.013095","54.149.16.101","192.168.43.153","TCP","66","https > 45133 [ACK] Seq=1 Ack=224 Win=11776 Len=0 TSval=1489637921 TSecr=1016275"
"699","88.013369","54.149.16.101","192.168.43.153","TLSv1","219","Server Hello, Change Cipher Spec, Encrypted Handshake Message"
"700","88.013401","192.168.43.153","54.149.16.101","TCP","66","45133 > https [ACK] Seq=224 Ack=154 Win=15744 Len=0 TSval=1016364 TSecr=1489637921"
"701","88.014021","192.168.43.153","54.149.16.101","TLSv1","125","Change Cipher Spec, Encrypted Handshake Message"
"702","88.014814","192.168.43.153","54.149.16.101","TLSv1","764","Application Data, Application Data"
"703","88.023080","54.149.16.101","192.168.43.153","TCP","66","https > 45132 [ACK] Seq=1 Ack=224 Win=11776 Len=0 TSval=1489637924 TSecr=1016275"
"704","88.023358","54.149.16.101","192.168.43.153","TLSv1","219","Server Hello, Change Cipher Spec, Encrypted Handshake Message"
"705","88.023390","192.168.43.153","54.149.16.101","TCP","66","45132 > https [ACK] Seq=224 Ack=154 Win=15744 Len=0 TSval=1016367 TSecr=1489637924"
"706","88.023998","192.168.43.153","54.149.16.101","TLSv1","125","Change Cipher Spec, Encrypted Handshake Message"
"707","88.024814","192.168.43.153","54.149.16.101","TLSv1","780","Application Data, Application Data"
"708","88.275958","192.168.43.153","216.58.203.142","TCP","66","42205 > http [FIN, ACK] Seq=1 Ack=1 Win=1307 Len=0 TSval=1016430 TSecr=2053129471"
"709","88.282959","54.149.16.101","192.168.43.153","TCP","66","https > 45135 [ACK] Seq=1 Ack=224 Win=28160 Len=0 TSval=1489637989 TSecr=1016345"
"710","88.283219","54.149.16.101","192.168.43.153","TLSv1","219","Server Hello, Change Cipher Spec, Encrypted Handshake Message"
"711","88.283249","192.168.43.153","54.149.16.101","TCP","66","45135 > https [ACK] Seq=224 Ack=154 Win=15744 Len=0 TSval=1016432 TSecr=1489637989"
"712","88.283871","192.168.43.153","54.149.16.101","TLSv1","125","Change Cipher Spec, Encrypted Handshake Message"
"713","88.312496","54.149.16.101","192.168.43.153","TCP","66","https > 45134 [ACK] Seq=1 Ack=224 Win=11776 Len=0 TSval=1489637995 TSecr=1016348"
"714","88.312812","54.149.16.101","192.168.43.153","TLSv1","219","Server Hello, Change Cipher Spec, Encrypted Handshake Message"
"715","88.312827","192.168.43.153","54.149.16.101","TCP","66","45134 > https [ACK] Seq=224 Ack=154 Win=15744 Len=0 TSval=1016439 TSecr=1489637996"
"716","88.314195","192.168.43.153","54.149.16.101","TLSv1","125","Change Cipher Spec, Encrypted Handshake Message"
"717","88.337111","54.149.16.101","192.168.43.153","TCP","66","https > 45136 [ACK] Seq=1 Ack=224 Win=28160 Len=0 TSval=1489638003 TSecr=1016348"
"718","88.337386","54.149.16.101","192.168.43.153","TLSv1","219","Server Hello, Change Cipher Spec, Encrypted Handshake Message"
"719","88.337407","192.168.43.153","54.149.16.101","TCP","66","45136 > https [ACK] Seq=224 Ack=154 Win=15744 Len=0 TSval=1016445 TSecr=1489638003"
"720","88.337943","192.168.43.153","54.149.16.101","TLSv1","125","Change Cipher Spec, Encrypted Handshake Message"
"721","88.373092","216.58.203.142","192.168.43.153","TCP","66","http > 42205 [FIN, ACK] Seq=1 Ack=2 Win=462 Len=0 TSval=2053245462 TSecr=1016430"
"722","88.373136","192.168.43.153","216.58.203.142","TCP","66","42205 > http [ACK] Seq=2 Ack=2 Win=1307 Len=0 TSval=1016454 TSecr=2053245462"
"723","88.376488","54.149.16.101","192.168.43.153","TCP","66","https > 45131 [ACK] Seq=154 Ack=283 Win=11776 Len=0 TSval=1489638014 TSecr=1016359"
"724","88.386018","54.149.16.101","192.168.43.153","TCP","66","https > 45131 [ACK] Seq=154 Ack=981 Win=13312 Len=0 TSval=1489638015 TSecr=1016359"
"725","88.391678","54.149.16.101","192.168.43.153","TCP","590","[TCP segment of a reassembled PDU]"
"726","88.392027","54.149.16.101","192.168.43.153","TLSv1","363","Application Data"
"727","88.392048","192.168.43.153","54.149.16.101","TCP","66","45131 > https [ACK] Seq=981 Ack=975 Win=17920 Len=0 TSval=1016459 TSecr=1489638017"
"728","88.436155","54.149.16.101","192.168.43.153","TCP","66","https > 45133 [ACK] Seq=154 Ack=283 Win=11776 Len=0 TSval=1489638027 TSecr=1016364"
"729","88.442069","54.149.16.101","192.168.43.153","TCP","66","https > 45133 [ACK] Seq=154 Ack=981 Win=13312 Len=0 TSval=1489638028 TSecr=1016364"
"730","88.447710","54.149.16.101","192.168.43.153","TCP","590","[TCP segment of a reassembled PDU]"
"731","88.448024","54.149.16.101","192.168.43.153","TLSv1","555","Application Data"
"732","88.448038","192.168.43.153","54.149.16.101","TCP","66","45133 > https [ACK] Seq=981 Ack=1167 Win=17920 Len=0 TSval=1016473 TSecr=1489638029"
"733","88.479129","54.149.16.101","192.168.43.153","TCP","66","https > 45132 [ACK] Seq=154 Ack=997 Win=13312 Len=0 TSval=1489638038 TSecr=1016367"
"734","88.488118","54.149.16.101","192.168.43.153","TCP","590","[TCP segment of a reassembled PDU]"
"735","88.488437","54.149.16.101","192.168.43.153","TCP","590","[TCP segment of a reassembled PDU]"
"736","88.488451","192.168.43.153","54.149.16.101","TCP","66","45132 > https [ACK] Seq=997 Ack=1202 Win=17792 Len=0 TSval=1016483 TSecr=1489638040"
"737","88.488470","54.149.16.101","192.168.43.153","TLSv1","239","Application Data"
"738","88.527048","192.168.43.153","54.149.16.101","TCP","66","45132 > https [ACK] Seq=997 Ack=1375 Win=18944 Len=0 TSval=1016493 TSecr=1489638040"
"739","88.657996","54.149.16.101","192.168.43.153","TCP","66","https > 45135 [ACK] Seq=154 Ack=283 Win=28160 Len=0 TSval=1489638084 TSecr=1016432"
"740","88.686162","54.149.16.101","192.168.43.153","TCP","66","https > 45134 [ACK] Seq=154 Ack=283 Win=11776 Len=0 TSval=1489638089 TSecr=1016439"
"741","88.689938","54.149.16.101","192.168.43.153","TCP","66","https > 45136 [ACK] Seq=154 Ack=283 Win=28160 Len=0 TSval=1489638092 TSecr=1016445"
"742","91.277243","192.168.43.153","35.160.100.86","TLSv1","103","Encrypted Alert"
"743","91.277302","192.168.43.153","35.160.100.86","TCP","66","44294 > https [FIN, ACK] Seq=356 Ack=3724 Win=22016 Len=0 TSval=1017180 TSecr=64074684"
"744","91.649015","35.160.100.86","192.168.43.153","TCP","78","[TCP Dup ACK 625#1] https > 44294 [ACK] Seq=3724 Ack=319 Win=13056 Len=0 TSval=64075889 TSecr=1016083 SLE=356 SRE=357"
"745","91.649264","35.160.100.86","192.168.43.153","TCP","66","https > 44294 [ACK] Seq=3724 Ack=357 Win=13056 Len=0 TSval=64075893 TSecr=1017180"
"746","91.649302","35.160.100.86","192.168.43.153","TLSv1","103","Encrypted Alert"
"747","91.649319","192.168.43.153","35.160.100.86","TCP","54","44294 > https [RST] Seq=357 Win=0 Len=0"
"748","91.649347","35.160.100.86","192.168.43.153","TCP","66","https > 44294 [FIN, ACK] Seq=3761 Ack=357 Win=13056 Len=0 TSval=64075893 TSecr=1017180"
"749","91.649357","192.168.43.153","35.160.100.86","TCP","54","44294 > https [RST] Seq=357 Win=0 Len=0"
"750","93.278319","192.168.43.153","54.149.16.101","TLSv1","103","Encrypted Alert"
"751","93.278368","192.168.43.153","54.149.16.101","TCP","66","45134 > https [FIN, ACK] Seq=320 Ack=154 Win=15744 Len=0 TSval=1017680 TSecr=1489638089"
"752","93.278683","192.168.43.153","54.149.16.101","TLSv1","103","Encrypted Alert"
"753","93.278763","192.168.43.153","54.149.16.101","TCP","66","45136 > https [FIN, ACK] Seq=320 Ack=154 Win=15744 Len=0 TSval=1017680 TSecr=1489638092"
"754","93.278984","192.168.43.153","54.149.16.101","TLSv1","103","Encrypted Alert"
"755","93.279010","192.168.43.153","54.149.16.101","TCP","66","45135 > https [FIN, ACK] Seq=320 Ack=154 Win=15744 Len=0 TSval=1017680 TSecr=1489638084"
"756","93.877620","54.149.16.101","192.168.43.153","TCP","78","[TCP Dup ACK 740#1] https > 45134 [ACK] Seq=154 Ack=283 Win=11776 Len=0 TSval=1489639322 TSecr=1016439 SLE=320 SRE=321"
"757","93.877859","54.149.16.101","192.168.43.153","TCP","78","[TCP Dup ACK 739#1] https > 45135 [ACK] Seq=154 Ack=283 Win=28160 Len=0 TSval=1489639324 TSecr=1016432 SLE=320 SRE=321"
"758","93.877897","54.149.16.101","192.168.43.153","TCP","78","[TCP Dup ACK 741#1] https > 45136 [ACK] Seq=154 Ack=283 Win=28160 Len=0 TSval=1489639325 TSecr=1016445 SLE=320 SRE=321"
"759","93.877905","54.149.16.101","192.168.43.153","TCP","66","https > 45134 [ACK] Seq=154 Ack=321 Win=11776 Len=0 TSval=1489639327 TSecr=1017680"
"760","93.877921","54.149.16.101","192.168.43.153","TCP","66","https > 45135 [ACK] Seq=154 Ack=321 Win=28160 Len=0 TSval=1489639328 TSecr=1017680"
"761","93.877930","54.149.16.101","192.168.43.153","TLSv1","103","Encrypted Alert"
"762","93.877948","192.168.43.153","54.149.16.101","TCP","54","45134 > https [RST] Seq=321 Win=0 Len=0"
"763","93.878183","54.149.16.101","192.168.43.153","TCP","66","https > 45134 [FIN, ACK] Seq=191 Ack=321 Win=11776 Len=0 TSval=1489639327 TSecr=1017680"
"764","93.878219","192.168.43.153","54.149.16.101","TCP","54","45134 > https [RST] Seq=321 Win=0 Len=0"
"765","93.878236","54.149.16.101","192.168.43.153","TLSv1","103","Encrypted Alert"
"766","93.878243","192.168.43.153","54.149.16.101","TCP","54","45135 > https [RST] Seq=321 Win=0 Len=0"
"767","93.878250","54.149.16.101","192.168.43.153","TCP","66","https > 45135 [FIN, ACK] Seq=191 Ack=321 Win=28160 Len=0 TSval=1489639328 TSecr=1017680"
"768","93.878255","192.168.43.153","54.149.16.101","TCP","54","45135 > https [RST] Seq=321 Win=0 Len=0"
"769","93.878609","54.149.16.101","192.168.43.153","TCP","66","https > 45136 [ACK] Seq=154 Ack=321 Win=28160 Len=0 TSval=1489639329 TSecr=1017680"
"770","93.878657","54.149.16.101","192.168.43.153","TLSv1","103","Encrypted Alert"
"771","93.878675","192.168.43.153","54.149.16.101","TCP","54","45136 > https [RST] Seq=321 Win=0 Len=0"
"772","93.878688","54.149.16.101","192.168.43.153","TCP","66","https > 45136 [FIN, ACK] Seq=191 Ack=321 Win=28160 Len=0 TSval=1489639329 TSecr=1017680"
"773","93.878693","192.168.43.153","54.149.16.101","TCP","54","45136 > https [RST] Seq=321 Win=0 Len=0"
